title,description,url,published_date,source,country,language
China and the Philippines trade blame over South China Sea clash,The latest incident comes amid ongoing tensions between China and the Philippines over the disputed strategic waterway.,https://www.abc.net.au/news/2025-05-23/china-philippines-trade-blame-over-south-china-sea-clash/105326136,2025-05-22T14:20:48,ABC News,Australia,en
"Small plane crashes into San Diego neighbourhood, setting over 10 homes on fire","Authorities say multiple homes have been hit, causing a gigantic debris field in the Californian neighbourhood",https://www.abc.net.au/news/2025-05-22/small-plane-crashes-into-san-diego-neighbourhood/105326126,2025-05-22T13:56:04,ABC News,Australia,en
RBA deputy says China knew it had a strong hand in trade war with US,RBA deputy governor Andrew Hauser says he witnessed first-hand Chinas willingness to fight a US trade war.,https://www.abc.net.au/news/2025-05-22/rba-andrew-hauser-china-ready-for-trade-war-with-us/105325202,2025-05-22T11:10:41,ABC News,Australia,en
What we know about young couple shot dead outside Jewish museum in Washington DC,"Israel has identified the two victims, who were a young couple, and the suspect will be interrogated on Thursday morning.",https://www.abc.net.au/news/2025-05-22/what-we-know-about-washington-dc-shooting/105325572,2025-05-22T10:45:26,ABC News,Australia,en
"NT minister references Darwinism, quotes Nazi leader in anti-racism debate",The Northern Territorys multicultural affairs minister has defended referencing Charles Darwins theory of evolution and quoting Hitlers propaganda chief during a parliamentary debate about racism.,https://www.abc.net.au/news/2025-05-22/nt-minister-jinson-charls-links-charles-darwin-evolution-racism/105322908,2025-05-22T10:25:31,ABC News,Australia,en
Who are Kneecap and why has a member been charged with terrorism?,"British police have charged Liam OHanna, a member of the Irish rap group Kneecap, with a terrorism offence for allegedly waving a flag in support of Hezbollah at a concert in London. How did we get here?",https://www.abc.net.au/news/2025-05-22/who-are-kneecap-and-why-are-they-being-investigated/105241686,2025-05-22T09:52:05,ABC News,Australia,en
"AMA warns severe flu season ahead, as Qld cases surge by 36 per cent",Flu infections across the state are already 36 per cent higher than this time last year and health authorities are warning of a tough winter ahead.,https://www.abc.net.au/news/2025-05-22/queensland-influenza-cases-spike-severe-flu-season-ahead/105313134,2025-05-22T09:51:27,ABC News,Australia,en
NBL superstar Bryce Cotton set to sign with 36ers,"The Adelaide 36rs are set to announce a momentous signing, with NBL superstar and five-time MVP Bryce Cotton expected to join the club.",https://www.abc.net.au/news/2025-05-22/nbl-superstar-bryce-cotton-set-to-sign-with-adelaide-36ers/105325764,2025-05-22T09:32:38,ABC News,Australia,en
Dolphins defy atrocious conditions to smash Bulldogs in 36-point rout,The wind and the rain were meant to keep scores low but the Dolphins defied the odds to record the second-biggest win in their history against ladder-leaders Canterbury.,https://www.abc.net.au/news/2025-05-22/nrl-dolphins-record-win-bulldogs/105325780,2025-05-22T09:29:53,ABC News,Australia,en
Significant sums Misuse of public money claims referred for NT probe,The NT opposition leader has referred serious misuse of public money allegations at the Darwin Waterfront Corporation to a parliamentary committee.,https://www.abc.net.au/news/2025-05-22/nt-darwin-waterfront-allegations-public-accounts-committee-/105324002,2025-05-22T09:14:34,ABC News,Australia,en
Rio Tinto chief executive Jakob Stausholm steps down,"Mining giant Rio Tinto has announced chief executive Jakob Stausholm will step down, more than four years since he took over following global criticism of the company for its destruction of ancient rock shelters in WA.",https://www.abc.net.au/news/2025-05-22/rio-tinto-ceo-jakob-stausholm-steps-down/105325574,2025-05-22T09:04:54,ABC News,Australia,en
Father of Sandipan Dhar says Joondalup hospital destroyed their lives,"A coronial inquest into the death of a toddler at a Perth hospital has ended with emotional testimony from the boys father, who says his family had been betrayed.",https://www.abc.net.au/news/2025-05-22/sandipan-dhar-coronial-inquest-ends-emotional-testimony/105322376,2025-05-22T08:57:46,ABC News,Australia,en
Hopefully we see them in September Smith already eyeing rematch after close win,Bailey Smith said he probably wouldnt have played in the Cats close win over the Dogs if it wasnt against his old side as hes battling a shin injury.,https://www.abc.net.au/news/2025-05-22/afl-round-11-geelong-western-bulldogs-live-blog/105325464,2025-05-22T08:39:27,ABC News,Australia,en
Deeply frustrating Calls to end three-year delay on CSIRO land sale,"Once used for agricultural research, the development of the CSIRO Ginninderra Experiment Station, a 701-hectare area of land between Belconnen and the Barton Highway, was first floated a decade ago.",https://www.abc.net.au/news/2025-05-22/csiro-ginninderra-experiment-station-social-housing-sale/105324026,2025-05-22T07:53:01,ABC News,Australia,en
Theyre a lost cause Messages about in-laws shown in mushroom trial,"Erin Patterson wanted nothing to do with her extended family, according to online messages allegedly sent eight months before the fatal lunch at her home.",https://www.abc.net.au/news/2025-05-22/erin-patterson-trial-messages-criticising-simon-family/105321816,2025-05-22T07:40:04,ABC News,Australia,en
Domestic violence lecturer wont train police as controversial interview reviewed,A university lecturer who teaches Tasmanian police recruits about domestic violence will not be involved in police training courses while comments she made in an interview with controversial mens rights commentator Bettina Arndt are reviewed.,https://www.abc.net.au/news/2025-05-22/utas-lecturer-fiona-girkin-bettina-arndt-dv-comments/105317718,2025-05-22T07:39:45,ABC News,Australia,en
Ex-surf coach pleads guilty to child sex charges involving eight victims,The 28 charges against Connor John Christopher Lyons include indecent treatment of children and making child exploitation material.,https://www.abc.net.au/news/2025-05-22/queensland-surfing-coach-pleads-guilty-child-sex-abuse/105280926,2025-05-22T07:25:05,ABC News,Australia,en
Organisers say new sports for Brisbane Olympics need to be realistic,Olympic organisers say the focus for the 2032 Olympic and Paralympic Games will now shift to ensuring the venues will be the perfect platform for athletes despite concerns over pressures facing the construction industry.,https://www.abc.net.au/news/2025-05-22/brisbane-olympic-2032-focus-on-venues-construction/105322604,2025-05-22T07:19:03,ABC News,Australia,en
Regional SA council votes in favour of city-wide dry zone,Whyalla City Council will make an application to impose a city-wide dry zone after receiving anecdotal reports of an increase in alcohol-fuelled violence.,https://www.abc.net.au/news/2025-05-22/whyalla-council-votes-for-city-wide-dry-zone-alcohol/105315242,2025-05-22T07:08:45,ABC News,Australia,en
Its poison Gen Zs drinking habits are shifting,"For a long time, drinking has been seen as a rite of passage for young Australians, but thats changing.",https://www.abc.net.au/news/2025-05-22/why-fewer-teenagers-are-drinking-alcohol/105321876,2025-05-22T06:56:12,ABC News,Australia,en
North Koreas Kim Jong Un condemns warship accident as criminal act,"A new 5,000-tonne warship key to North Koreas naval advancement has been dropped on its side during its launching ceremony attended by leader Kim Jong Un.",https://www.abc.net.au/news/2025-05-22/north-korea-kim-jong-un-condemns-warship-accident/105323652,2025-05-22T06:55:24,ABC News,Australia,en
"Watt clears path for Woodside decision, rejecting green group concerns","The path has been cleared for a final decision on Woodsides proposal to extend the life of its North West Shelf gas project to 2070, with Environment Minister Murray Watt formally rejecting challenges by environment groups over the gas facility.",https://www.abc.net.au/news/2025-05-22/murray-watt-reject-environment-challenges-woodside-gas-wa/105323950,2025-05-22T06:49:34,ABC News,Australia,en
No love lost between Littleproud and Ley as they seek to reunite Coalition,"While water devastated regional communities, senior Nationals were in Canberra divvying up the spoils of defeat.",https://www.abc.net.au/news/2025-05-22/littleproud-ley-coalition-split-floods-shoey/105309018,2025-05-22T06:30:26,ABC News,Australia,en
Bondi killers satanic control claim not taken seriously by psychiatrist,Five experienced psychiatrists were called by the Westfield Bondi Junction inquest to provide their opinions on the treatment of Joel Cauchis mental health prior to the stabbing attack.,https://www.abc.net.au/news/2025-05-22/five-psychiatrists-evidence-dispute-dr-a-bondi-junction-inquest/105324318,2025-05-22T06:11:28,ABC News,Australia,en
Expelled Labor MP breaks down in parliament as he defends alleged DV incident,"In an emotional speech in parliament and speaking for the first time as an independent, Jimmy Sullivan addresses a recent alleged domestic incident saying it was not violent.",https://www.abc.net.au/news/2025-05-22/jimmy-sullivan-becomes-emotional-in-state-parliament/105324004,2025-05-22T06:06:27,ABC News,Australia,en
