title,description,url,published_date,source,country,language
"Justiça mantém prisão de homem que fez idosa refém com faca em mercado em São José dos Campos, SP","Caso aconteceu na tarde desta quarta-feira 21, em um mercado no Jardim Paulista, na região central da cidade. A mulher foi libertada e passa bem. Justiça mantém prisão de homem que fez idosa refém com faca em mercado em São José dos Campos Foto 1 Leandro dos SantosVanguarda Repórter  Foto 2 João MotaTV Vanguarda A Justiça manteve, nesta quinta-feira 22, a prisão do homem que foi detido após fazer uma idosa de refém e ameaçá-la com uma faca, em um mercado de São José dos Campos, no interior de SP.  Clique aqui para seguir o canal do g1 Vale do Paraíba e região no WhatsApp O homem foi preso em flagrante pela Polícia Militar na noite desta quarta-feira 21 e passou por audiência de custódia na manhã desta quinta-feira. A audiência de custódia é um procedimento de rotina que ocorre quando alguém é preso. O objetivo é saber se a prisão ocorreu de maneira legal. Com a prisão mantida pela Justiça, a prisão em flagrante do homem foi convertida em prisão preventiva. O homem deve permanecer preso durante o andamento das investigações. O g1 tenta contato com a defesa do homem preso. A reportagem será atualizada caso os advogados se manifestem. VÍDEO Homem é preso após fazer idosa refém com faca em mercado em São José dos Campos, SP Refém no mercado Um homem foi preso pela Polícia Militar após fazer uma idosa de 78 anos refém com uma faca, em um mercado na região central de São José dos Campos, na tarde desta quarta-feira 21. O homem foi preso e a mulher libertada após cerca de 20 minutos de negociação. Imagens gravadas por testemunhas mostram a mulher sendo feita refém no estabelecimento - veja vídeo acima. O g1 apurou que o caso aconteceu por volta das 18h, no mercado Sonda, que fica na Av. Nair Toledo de Mira, no Jardim Paulista, em São José. Segundo a polícia, o homem estava furtando objetos do mercado, mas a segurança do local viu e foi abordá-lo. No entanto, o homem percebeu que tinha sido descoberto pela segurança, então pegou uma faca e fez uma cliente idosa de refém. A idosa foi agarrada pelo criminoso, que a segurou pelo pescoço e a ameaçou com uma faca. Após negociação com a polícia, o homem se entregou e soltou a idosa. A mulher ficou bastante nervosa, mas não precisou de atendimento médico. Ninguém se feriu. Por meio de nota, o Sonda Supermercados disse que foi registrado um episódio isolado em suas dependências, cuja origem e circunstâncias ainda são desconhecidas. A pronta atuação das forças de segurança garantiu que a situação fosse rapidamente controlada, sem registro de feridos. Ainda segundo o mercado, eles estão colaborando com as autoridades competentes para o completo esclarecimento dos fatos e reafirmaram o compromisso com a segurança, o bem-estar e a tranquilidade dos clientes e colaboradores. Mulher é feita refém por bandido em São José dos Campos Homem é preso após fazer idosa refém com faca em mercado em São José dos Campos, SP João MotaTV Vanguarda Homem é preso após fazer idosa refém com faca em mercado em São José dos Campos, SP João MotaTV Vanguarda Homem é preso após fazer idosa refém com faca em mercado em São José dos Campos, SP Leandro dos SantosVanguarda Repórter Veja mais notícias do Vale do Paraíba e região bragantina",https://g1.globo.com/sp/vale-do-paraiba-regiao/noticia/2025/05/22/justica-mantem-prisao-de-homem-que-fez-idosa-refem-com-faca-em-mercado-em-sao-jose-dos-campos-sp.ghtml,2025-05-22T14:37:35,G1,Brazil,pt
"Mulher morre após ser atingida por tiro dentro de casa e ficar internada, no Paraná ex-marido é procurado pela polícia","Crime aconteceu em Cambé, na terça-feira 20. Daiane Pascoaleto, de 36 anos, estava saindo para trabalhar quando foi ferida. g1 tenta identificar defesa do suspeito. Morre mulher agredida pelo ex-companheiro em Cambé Daiane Pascoaleto, de 36 anos, morreu depois de ser atingida por um tiro em Cambé, no norte do Paraná. Ela foi ferida dentro de casa, no momento em que saía para o trabalho. De acordo com a Polícia Militar PM-PR, o ex-marido é o principal suspeito de ter cometido o crime e não foi encontrado.  Siga o canal do g1 Londrina no WhatsApp  Siga o canal do g1 PR no Telegram O caso foi registrado no início da manhã de terça-feira 20. Conforme o boletim de ocorrência divulgado pela PM, a filha da vítima relatou aos policiais militares que Sandro Francisco de Almeida foi ao local por não aceitar a separação. A filha também relatou que o casal tinha discussões recorrentes e que o autor havia feito ameaças anteriormente. Apesar do histórico de violência relatado pela testemunha, a vítima nunca havia feito acionamento da polícia para denunciar casos de violência doméstica, diz o boletim divulgado. Ciclo da violência Saiba como identificar Violência contra mulher Veja os canais de denúncia disponíveis no Paraná A morte de Daiane foi confirmada pela Santa Casa de Cambé, onde ela estava internada, na noite desta quarta-feira 21. Na terça, o hospital informou que a vítima estava consciente e conversando. Entretanto, houve piora no estado de saúde e ela precisou passar por cirurgia. Depois, ficou internada na Unidade de Terapia Intensiva UTI. Também no dia do crime, a PM divulgou o nome de Sandro e disse que ele estava foragido. Até a publicação desta reportagem, ele não foi encontrado. O g1 tenta identificar a defesa dele. LEIA TAMBÉM Cadela jogada em compactador de lixo MP afirma que coletores não tiveram intenção de maltratar animal e arquiva processo Expoingá Ao menos 15 vigilantes de empresa de segurança não tinham certificado para atuar em grandes eventos, diz PF Investigação Pai é suspeito de levar filha adolescente a motel e abusar dela junto com namorada Daiane foi atingida por um tiro enquanto saía para trabalhar. ReproduçãoRedes sociais VÍDEOS Mais assistidos do g1 Paraná Leia mais notícias em g1 Norte e Noroeste.",https://g1.globo.com/pr/norte-noroeste/noticia/2025/05/22/mulher-morre-apos-ser-atingida-por-tiro-no-parana-ex-e-procurado.ghtml,2025-05-22T14:37:29,G1,Brazil,pt
"Mulher morre após esfaquear homem durante briga e suspeito revidar, diz polícia","Crime aconteceu em Xambioá, região norte do estado. Vítima e o suspeito estavam discutindo, quando o homem revidou após levar duas facadas nas costas. Viatura da Polícia Militar do Tocantins Divulgação PMTO Uma jovem de 22 anos morreu após ser esfaqueada durante uma briga com um homem, em Xambioá, região norte do estado. Ela foi identificada, pela Polícia Civil, como Maria Eduarda Alves Nascimento. Segundo a Polícia Militar PM, os dois estavam discutindo, e o homem revidou após levar duas facadas desferidas por ela. O crime aconteceu em um bar na rua Joaquim Vitorino de Assunção, por volta das 19h30 desta quarta-feira 21. O nome dele não foi divulgado, por isso o g1 não conseguiu contato com sua defesa ou atualizar seu estado de saúde.  Participe do canal do g1 TO no WhatsApp e receba as notícias no celular. Testemunhas disseram aos policiais militares que, momentos antes do crime, a mulher e o homem iniciaram uma discussão. Segundo a Polícia Civil, os dois estavam consumindo bebidas alcóolicas e a mulher quis ir embora, mas foi impedida pelo autor. A discussão evoluiu para agressões mútuas com facas. Ainda conforme a polícia, a mulher desferiu pelo menos dois golpes nas costas do homem, que revidou e esfaqueou Maria Eduarda na região abdominal. Quando chegaram ao local, os militares encontram os dois feridos e ambos foram levados ao hospital regional da cidade. A mulher não resistiu e morreu. LEIA MAIS Menino que sobreviveu a picada de jararaca foi surpreendido por cobra Estava fechando o portão Família relata angústia após 18 dias sem informações sobre jovem desaparecido Aumenta o medo de não encontrar ele, diz prima A PM informou que, devido aos ferimentos, o suspeito permaneceu internado no hospital. A Secretaria da Segurança Pública informou o corpo de Maria Eduarda foi levado para o Núcleo de Medicina Legal de Araguaína, onde aguarda os familiares com a documentação necessária para os exames necroscópicos e posterior liberação. O caso está sendo investigado pela 22ª Delegacia de Xambioá. Veja mais notícias da região no g1 Tocantins.",https://g1.globo.com/to/tocantins/noticia/2025/05/22/mulher-morre-apos-esfaquear-homem-durante-briga-e-suspeito-revidar-diz-policia.ghtml,2025-05-22T14:34:57,G1,Brazil,pt
Assista ao Jornal do Almoço,"Assista ao Jornal do Almoço O g1 transmite ao vivo, de segunda a sexta, os telejornais da RBS TV Bom Dia Rio Grande, Jornal do Almoço e RBS Notícias. . Aos sábados, temos transmissão ao vivo também do Jornal do Almoço e do RBS Notícias.. Acompanhe o canal do g1 RS no WhatsApp",https://g1.globo.com/rs/rio-grande-do-sul/ao-vivo/assista-ao-vivo-aos-telejornais-da-rbs-tv.ghtml,2025-05-22T14:34:12,G1,Brazil,pt
Assista aos telejornais da TV Gazeta de Alagoas,Assista aos telejornais da TV Gazeta de Alagoas,https://g1.globo.com/al/alagoas/ao-vivo/assista-aos-telejornais-da-tv-gazeta-de-alagoas.ghtml,2025-05-22T14:33:21,G1,Brazil,pt
Dia da Chardonnay 5 vinhos elegantes da Argentina,"Saiba tudo sobre essa nobre uva branca e descubra rótulos imperdíveis. A Chardonnay é uma das variedades de uva mais populares e amplamente cultivadas no mundo, reconhecida por sua versatilidade e capacidade de refletir diferentes terroirs. Seus aromas variam de notas cítricas, maçã verde e pêssego, a nuances de manteiga, baunilha e toques amanteigados, especialmente quando passa por fermentação em barril. No paladar, o vinho pode ser fresco e leve ou encorpado e untuoso, dependendo do método de vinificação, o que faz dele uma escolha bastante democrática para diferentes estilos de consumo. A Chardonnay é cultivada em climas variados, o que influencia diretamente suas características. Na França, especialmente na Borgonha, é conhecida por produzir vinhos elegantes, com notas minerais e complexidade aromática. Nos Estados Unidos, na Califórnia, a variedade tende a ser mais frutada e encorpada, com destaque para sabores de frutas tropicais e baunilha. Na Austrália, o estilo dos vinhos varia de fresco a mais robusto, enquanto na Itália, especialmente na região do Friuli, o Chardonnay apresenta uma mineralidade marcante. A Argentina, por sua vez, tem se destacado na produção de Chardonnay de alta qualidade, especialmente nas regiões de Mendoza, Salta e Patagônia. Os vinhos argentinos costumam apresentar um equilíbrio interessante entre frescor e complexidade, com aromas de frutas cítricas, maçã, pera e notas de baunilha, resultado do uso de barris de carvalho em alguns casos. A altitude elevada das vinícolas argentinas contribui para uma acidez vibrante, que confere ao vinho uma estrutura elegante. Além disso, a diversidade de climas e solos argentinos permite a produção de Chardonnays com diferentes perfis, atendendo tanto aos apreciadores de vinhos mais leves quanto aos que preferem versões mais complexas. Com sua adaptabilidade e riqueza de aromas, o Chardonnay continua conquistando paladares ao redor do mundo, e a produção argentina vem ganhando destaque por oferecer opções de alta qualidade, que unem tradição e inovação. Descubra 5 vinhos argentinos elaborados com a Chardonnay que você precisa ter na sua adega. Porteño Chardonnay Divulgação Refrescante, o Porteño Chardonnay apresenta aromas de frutas brancas, como maçã verde, e tropicais, como abacaxi. Em boca, revela-se um vinho equilibrado, com boa acidez e um final especialmente saboroso. Acompanha saladas e queijos moles. Norton Select Chardonnay Divulgação Assinado pela premiada vinícola Norton, esse rótulo apresenta aromas frutados, que lembram abacaxi e pêssego. Em boca, é um vinho refrescante e frutado, com final delicado. Acompanha culinária vegana, comida japonesa e pratos à base de peixes. Alfredo Roca Fincas Chardonnay Divulgação Do terroir de San Rafael, em Mendoza, esse vinho apresenta aroma de fruta branca e toque amanteigado. Em boca, é seco, possui boa acidez e ótimo sabor. Ideal para acompanhar saladas e peixes. Alambrado Etiqueta Negra Chardonnay Divulgação Apresenta aromas complexos de frutas brancas maduras como peras e maçãs, com notas de baunilha, manteiga e mel. Em boca, é untuoso e com expressivas notas frutadas. Harmoniza com culinária japonesa, peruana e pratos à base de peixes leves. Norton Reserva Chardonnay Divulgação Produzido a partir de uvas Chardonnay criteriosamente selecionadas do Vale do Uco e Luján de Cuyo, em Mendoza, o Norton Reserva Chardonnay se destaca pela intensidade aromática, com notas de frutas tropicais, um toque amanteigado e nuances sutis de pão torrado. No paladar, revela-se um vinho sedoso e equilibrado. Amadureceu por 6 meses em barricas de carvalho. Acompanha massas com molhos leves, pratos à base de peixes e frutos do mar e tábua de queijos. BEBA MENOS, BEBA MELHOR.",https://g1.globo.com/pr/parana/especial-publicitario/porto-a-porto/guia-do-vinho-e-da-gastronomia/noticia/2025/05/22/dia-da-chardonnay-5-vinhos-elegantes-da-argentina.ghtml,2025-05-22T14:32:37,G1,Brazil,pt
PT não consegue urnas eletrônicas e terá voto impresso em eleições internas,"Partido pediu equipamentos à Justiça Eleitoral, mas nem todos os tribunais regionais aceitaram emprestar urnas. Novo presidente da sigla será escolhido em 6 de julho ex-ministro Edinho Silva é tido como favorito. A executiva nacional do PT decidiu nesta quarta-feira 21 que as eleições internas da sigla, marcadas para o dia 6 de julho, serão realizadas em cédula de papel. A decisão foi tomada após a legenda não conseguir que a Justiça Eleitoral emprestasse urnas eletrônicas para o processo. O PT havia consultado o Tribunal Superior Eleitoral TSE sobre a possibilidade, mas foi informado pelo órgão de que a decisão sobre o empréstimo cabia aos Tribunais Regionais Eleitorais TREs. O partido defendia o uso das urnas no processo interno por avaliar que os equipamentos são mais seguros e confiáveis, além de agilizar a divulgação de resultados. Segundo informações de dirigentes do partido, apenas parte dos 27 TREs concordou em emprestar os equipamentos. Sem uma decisão unificada da Justiça Eleitoral, e para evitar que estados tivessem processos eleitorais diferentes, a sigla optou por definir que o pleito será inteiramente feito em cédulas. Como o TSE não consegue fornecer urnas eletrônicas em todos estados e cidades onde haverá votação, chegamos à conclusão de que é melhor fazer com cédulas para ficar igual no Brasil inteiro. Faremos como no último PED Processo de Eleição Direta, afirmou ao g1 o secretário-geral do partido, Henrique Fontana. Edinho Silva critica reunião na casa de Gleisi sobre sucessão no PT O PT se prepara para renovar as direções da sigla em todo o país. As eleições serão diretas  isto é, os filiados poderão votar diretamente para escolher os novos comandantes. As cédulas de votação serão produzidas pelo próprio partido, e a contagem dos votos será manual. No cenário nacional, o ex-prefeito de Araraquara Edinho Silva é o favorito para conquistar a presidência do partido. Edinho conseguiu reunir apoio unificado da maior corrente interna da sigla e do presidente Lula. Aliados estimam que ele terá votos suficientes para se eleger em primeiro turno. Além dele, outros quatro nomes se candidataram para disputar o comando nacional do partido Rui Falcão Romênio Pereira Valter Pomar e Dani Nunes. O presidente eleito tomará posse no encontro nacional do PT, que ocorrerá nos primeiros dias de agosto. O mandato será de quatro anos. Lula dá puxão de orelha no PT É preciso gastar sola de sapato na periferia",https://g1.globo.com/politica/noticia/2025/05/22/pt-nao-consegue-urnas-eletronicas-e-tera-voto-impresso-em-eleicoes-internas.ghtml,2025-05-22T14:32:25,G1,Brazil,pt
O novo conceito de viver bem alto padrão inteligente chega a Campinas,"Localizado em uma região privilegiada, com plantas personalizáveis e integração com a natureza, o lançamento da Congesa e 3Z Realty une sofisticação e bem-estar. Crédito Divulgação Com atuação consolidada no segmento de alto padrão, a Congesa anuncia o lançamento do condomínio Casa Arborais Altavista, em Campinas . O projeto, realizado em parceria com a 3Z Realty, empresa do Grupo NC, marca mais um capítulo na expansão de empreendimentos que aliam modernidade, sustentabilidade e qualidade de vida. Com Valor Geral de Vendas VGV estimado em R 170 milhões, o novo condomínio será implantado em uma das regiões mais valorizadas de Campinas, em uma área superior a 24 mil m². O Casa Arborais Altavista contará com apenas 73 unidades residenciais, reforçando o conceito de exclusividade e conforto. As casas terão 160 m² ou 195 m², com 3 a 4 suítes. Lançado sob o conceito de casas de alto padrão inteligente, o projeto foi cuidadosamente desenhado para atender às novas demandas de moradia, incluindo infraestrutura voltada à mobilidade elétrica, com pontos de recarga previstos nas unidades, e soluções que facilitam a integração entre tecnologia e bem-estar. O Casa Arborais Altavista foi planejado para oferecer convivência harmônica entre a natureza e a cidade, combinando paisagismo e grandes áreas verdes com a proximidade a importantes rodovias, centros comerciais, hospitais e escolas, unindo o melhor dos dois mundos. Mais do que um novo lançamento, o Casa Arborais Altavista representa a evolução de um estilo de morar que valoriza o conforto, a privacidade e uma relação mais equilibrada com o entorno. Visite o site.",https://g1.globo.com/sp/campinas-regiao/especial-publicitario/casa-arborais-alta-vista/noticia/2025/05/22/o-novo-conceito-de-viver-bem-alto-padrao-inteligente-chega-a-campinas.ghtml,2025-05-22T14:31:16,G1,Brazil,pt
Três homens são presos suspeitos de furtarem cabos de energia de fazenda em Várzea da Palma,"O proprietário da fazenda contou à Polícia Militar que percebeu os homens com uniformes de uma empresa de telecomunicações retirando os cabos da propriedade dele. Ao questionar a ação, o grupo teria respondido que a retirada estava sendo feita por ordem da empresa. Cabos de energa foram recuperados Polícia Militar Três homens, de 31, 35 e 37 anos foram presos suspeitos de furtarem cabos de energia de uma fazenda, na zona rural de Várzea da Palma, nessa quarta-feira 21. O proprietário da fazenda contou à Polícia Militar que percebeu os homens com uniformes de uma empresa de telecomunicações retirando os cabos da propriedade dele. Ao questionar a ação, o grupo teria respondido que a retirada estava sendo feita por ordem da empresa. Clique aqui para seguir o canal do g1 Grande Minas no WhatsApp A vítima desconfiou e resolveu acionar a PM. Após levantar as informações, os policiais conseguiram localizar o veículo usado pelos homens para transportar o material transitando na estrada de acesso à fazenda. Ao realizar buscas pelo automóvel, os militares encontraram aproximadamente 350 metros de cabos de energia. Conforme a polícia, ao serem perguntados pelo material, os autores teriam confessado o crime. Os homens foram conduzidos à delegacia e os cabos recuperados. Vídeos do Norte, Centro e Noroeste de MG Veja mais notícias da região em g1 Grande Minas.",https://g1.globo.com/mg/grande-minas/noticia/2025/05/22/tres-homens-sao-presos-suspeitos-de-furtarem-cabos-de-energia-de-fazenda-em-varzea-da-palma.ghtml,2025-05-22T14:30:13,G1,Brazil,pt
"Homem é preso transportando 5 kg de pasta base de cocaína na Via Dutra, em Resende","Prisão aconteceu na altura do km 308, sentido Rio de Janeiro. Homem é preso transportando 5kg de pasta base na Via Dutra, em Resende ReproduçãoPRF Um homem foi preso na manhã desta quinta-feira 22 transportando 5 kg de pasta base de cocaína em Resende RJ. A prisão aconteceu durante um policiamento na Via Dutra, na altura do km 308, no sentido Rio de Janeiro, por volta da 7h30. Clique aqui e entre no canal do g1 no WhatsApp Segundo a Polícia Rodoviária Federal, o suspeito foi abordado pelos policiais enquanto dirigia. Ele informou que estaria indo até a casa de um primo em Barra Mansa RJ, mas não soube dizer em qual endereço. Ele disse informações desconexas aos agentes, que levantou suspeitas. Ainda de acordo com a PRF, durante uma revista no veículo, um fundo falso foi encontrado no assoalho do automóvel. Dentro do compartimento estavam cinco tabletes de pasta base de cocaína, com aproximadamente 1 kg cada. O homem foi encaminhado para a delegacia de Resende, e vai responder por tráfico interestadual de drogas. Homem é preso transportando 5kg de pasta base na Via Dutra, em Resende ReproduçãoPRF Siga a TV Rio Sul no Instagram VÍDEOS as notícias que foram ao ar na TV Rio Sul",https://g1.globo.com/rj/sul-do-rio-costa-verde/noticia/2025/05/22/homem-e-preso-transportando-5-kg-de-pasta-base-de-cocaina-na-via-dutra-em-resende.ghtml,2025-05-22T14:30:09,G1,Brazil,pt
Motorista sem CNH é indiciado por atropelar e matar mulher e filho dela no Dia das Mães com carro a 97 kmh,"Velocidade máxima permitida na via era de 40 kmh. Ele vai responder por homicídio doloso, quando se assume o risco de matar. Mãe e filho morrem atropelados após motorista sem CNH perder controle de carro A Polícia Civil indiciou o motorista que atropelou e matou uma mulher e o filho dela, no Dia das Mães, em Santa Luzia, por homicídio doloso  quando se assume o risco de matar. Em coletiva de imprensa realizada nesta quinta-feira 22, o delegado Fábio Lucas Gabrich Cruz e Silva disse que o carro estava a 97 kmh, sendo que o limite da via era de 40 kmh. RELEMBRE Mãe e filho morrem atropelados após motorista sem CNH perder controle de carro Inicialmente, Anestor Santos Carvalho seria indiciado por homicídio culposo, quando não há intenção de matar. Entretanto, o resultado da perícia que mostrou o excesso de velocidade contribuiu para a mudança na classificação do crime. Além disso, o pedreiro não tem Carteira Nacional de Habilitação CNH e, por isso, também responderá por direção inabilitada e o homicídio passou a ser tipificado como doloso. Ele sequer tinha capacidade objetivamente demonstrada pelas provas de um órgão competente de trânsito de ser capaz de evitar um resultado numa situação que exigiria do condutor uma atuação com as práticas de direção defensiva, afirmou o delegado. Lucilene Rodrigues Carneiro Neves e Luan Henrique Rodrigues Neves morreram atropelados por motorista sem CNH ReproduçãoRedes sociais O acidente O acidente foi registrado por uma câmera de segurança. As vítimas voltavam a pé para casa, depois de uma comemoração em família, quando foram atingidas pelo carro. Lucilene Rodrigues Carneiro Neves, de 40 anos, e Lucilene Rodrigues Carneiro Neves, de nove, morreram no local. Após o atropelamento, o veículo bateu em um muro e, em seguida, capotou. Anestor Santos Carvalho foi preso em flagrante e levado para o Presídio de Santa Luzia. A prefeitura da cidade decretou luto oficial no dia 12 de maio, quando os dois corpos foram sepultados. De acordo com o boletim de ocorrência, o homem disse à Polícia Militar que havia bebido uma pequena dose de uísque pela manhã. Mas o teste do bafômetro não apontou a ingestão de álcool. No último dia 11 de maio, o autor saiu de sua casa, percorreu um trajeto de aproximadamente 800 metros, um percurso que duraria cerca de três minutos. Ele alegou que, na noite anterior, havia ingerido um medicamento para dormir e que havia trabalhado o dia todo naquele Dia das Mães, detalhou o delegado. Ele alega que dormiu ao volante. A Polícia Civil aguarda o resultado do laudo pericial que vai confirmar essa versão. A Secretaria Estadual de Justiça e Segurança Pública informou que, atualmente, Anestor está detido no Presídio Inspetor Martinho Drumond, em Ribeirão das Neves. O g1 encontrou em contato com a defesa dele, mas não havia obtido retorno até a última atualização desta reportagem. Mãe e filho morrem atropelados após motorista sem carteira perder controle de carro DivulgaçãoPMMG Vídeos mais assistidos do g1 MG",https://g1.globo.com/mg/minas-gerais/noticia/2025/05/22/motorista-sem-cnh-e-indiciado-por-atropelar-e-matar-mulher-e-filho-dela-no-dia-das-maes-com-carro-a-97-kmh.ghtml,2025-05-22T14:29:34,G1,Brazil,pt
