title,description,url,published_date,source,country,language
Ex-comandante do Exército diz que decisão de não prender golpistas em 8 de janeiro foi divida com ministros do governo,"Júlio César de Arruda foi ouvido como testemunha de Mauro Cid. Militar foi questionado por sobre descumprimento de ordem judicial que previa prisão imediata de acampados. Ex- comandante do Exército, o general Júlio César de Arruda afirmou nesta quinta-feira 22 que dividiu com integrantes do governo do presidente Luiz Inácio Lula da Silva PT a decisão de não permitir a prisão imediata de quem estava no acampamento em frente ao QG do Exército em Brasília logo após os atos golpistas do dia 8 de janeiro. Arruda foi ouvido como testemunha de defesa do tenente-coronel Mauro Cid, e de Jair Bolsonaro na ação penal que apura um golpe de estado para manter o ex-presidente no poder de forma ilegal. STF começa a ouvir testemunhas de acusação e de defesa em julgamento do golpe Arruda foi questionado pelo ministro Alexandre de Moraes, relator do caso, sobre ter impedido o cumprimento da ordem de prisão no acampamento do QG. O ministro citou depoimento de Fábio Augusto Vieira, então comandante da Polícia Militar do DF. Ele disse que ao chegar para cumprir a ordem foi proibido por Arruda de retirar os acampados que, com dedo em riste, teria dito O senhor sabe que minha tropa é um pouco maior que a sua, né?. A ordem judicial de Moraes foi cumprida só na segunda de manhã. O general afirmou que agiu para acalmar a situação. Já respondi isso aí nas minhas declarações à Polícia Federal, vou repetir exatamente. Ali estava um clima de nervosismo, o senhor sabe disso, o senhor sabe bem disso, e minha função era acalmar. Então, eu falei isso aí tem que ser feito de maneira coordenada. Vamos fazer isso aí de forma coordenada, disse. Ex-comandante do Exército, general Júlio César de Arruda Jornal Nacional Reprodução Discussão com integrantes do governo O militar afirmou que discutiu a execução da ordem com o então ministro da Justiça Flávio Dino, o ministro da Casa Civil , Rui Costa, o ministro da Defesa, José Múcio, durante reunião no QG. E foi feito de maneira coordenada, como eu disse, de acordo com o ministro da Justiça na época, o ministro Flávio Dino, o ministro Rui Costa e o Ministro José Múcio, eu e o coronel Ruta. Foi decidido ali o que fazer. Então a minha função ali foi acalmar, porque até então e graças a deus não teve nenhuma morte. O general evitou responder questões mais polêmicas e recorreu a expressão não lembro em diversas ocasiões. O militar disse que não poderia comentar sobre o motivo de sua demissão no começo do governo Lula porque essa pergunta eu acho que não cabe a ser feita a mim. tem que fazer a quem me nomeou e quem me exonerou Em seu depoimento, o ex-comandante do Exército afirmou ainda que a transição no Exército entre o governo Bolsonaro para Lula ocorreu normalmente. A assessoria de comunicação do Supremo Tribunal Federal STF e dos ministros do governo disseram que Flávio Dino, José Múcio e Rui Costa não vão se manifestar. Negativo Arruda negou ter impedido ingresso da polícia no acampamento em frente ao quartel general do Exército ao ser questionado pelo procurador-geral da República, Paulo Gonet. Eu não neguei ingresso da polícia. Nessa noite, quando começou a acontecer aquilo tudo, eu fui pro QG às duas da tarde. Fui coordenar as ações, afirmou. O general afirmou que chamou o então comandante militar do Palácio do Planalto e o ministro da Defesa José Múcio. Acompanhamos os acontecimentos e lá pela noite, quando parte dos manifestantes estava voltando para a Praça dos Cristais, o general Dutra me ligou e disse que a polícia estava vindo aqui e eu tenho a informação de que iam prender todo mundo. E eu disse não, isso teria que ser coordenado, acha o interventor.",https://g1.globo.com/politica/noticia/2025/05/22/ex-comandante-do-exercito-diz-que-decisao-de-nao-prender-golpistas-em-8-de-janeiro-foi-divida-com-ministros-do-governo.ghtml,2025-05-22T13:29:35,G1,Brazil,pt
"VÍDEO Funcionário de farmácia expulsa assaltante usando lata de leite em pó, em Montes Claros","Crime foi nessa quarta-feira 21, no bairro Santa Lúcia I. Câmeras de segurança registraram o momento em que o autor entra no local, anuncia o assalto e foge após o colaborador o ameaçar com a embalagem. Funcionários expulsa assaltante com lata de leite em pó Câmeras de segurança de uma farmácia registraram o momento em que um assaltante foi expulso do estabelecimento por um funcionário que o ameaçou com uma lata de leite em pó, em Montes Claros. Veja vídeo acima. Caso foi nessa quarta-feira 21. As imagens mostraram que o autor entrou no local, no bairro Santa Lúcia I, se aproximou do balcão e conversou com um colaborador. Pouco depois, levantou a blusa para mostrar estar armado com uma faca e foi surpreendido pela reação do funcionário que ameaçou acertá-lo com uma lata de leite em pó. O assaltante saiu correndo e foi atingido pela embalagem. Clique aqui para seguir o canal do g1 Grande Minas no WhatsApp O farmacêutico, de 26 anos, contou que o suspeito chegou na farmácia de máscara e perguntou se tinha remédio para gripe. Ao responder sobre a medicação e o valor, o homem anunciou o assalto, pediu que passasse todo o dinheiro do caixa e mostrou o cabo de uma faca na cintura. A vítima relatou, ainda, que começou a pedir socorro e pegou a lata. O autor se assustou e o colaborador correu atrás dele, momento em que arremessou a embalagem contra o suspeito. O assaltante foi abordado e preso próximo ao local do crime por um policial que estava a paisana no bairro. Ele foi encaminhado para a delegacia de Montes Claros. Lata usada para atingir o assaltante Daniel CristianInter TV Grande Minas Vídeos do Norte, Centro e Noroeste de MG Veja mais notícias da região em g1 Grande Minas.",https://g1.globo.com/mg/grande-minas/noticia/2025/05/22/video-funcionario-expulsa-assaltante-usando-lata-de-leite-em-po-em-montes-claros.ghtml,2025-05-22T13:28:07,G1,Brazil,pt
Como a suplementação pode ajudar a manter a imunidade alta em tempos de maior exposição a vírus,"Descubra os principais sinais de imunidade baixa e como reforçar suas defesas com escolhas acessíveis para o dia a dia ReproduçãoFreepik Mudança de estação, rotina puxada, noites mal dormidas. Nosso corpo enfrenta inúmeros desafios todos os dias  e para manter o ritmo, ele precisa de equilíbrio. É aí que a imunidade entra em cena como um verdadeiro escudo natural. Nosso sistema imunológico é a nossa linha de frente contra vírus, bactérias e outros agressores. Quando ele está fortalecido, o corpo responde melhor às ameaças e se recupera mais rápido. Mas quando esse sistema está sobrecarregado, o corpo começa a enviar sinais. Pequenas infecções que se repetem, cansaço constante, aquela sensação de algo está para vir. São alertas de que está na hora de reforçar as defesas. E a suplementação pode ser uma aliada valiosa nesse processo. Nosso corpo dá sinais. Quando gripes se tornam frequentes ou a recuperação demora, é hora de reforçar as defesas, explica a nutricionista Maria Luísa S. Repula. Sinais de que sua imunidade pode estar baixa Gripes e resfriados recorrentes Cansaço prolongado Infecções urinárias frequentes Feridas que demoram a cicatrizar Coriza leve ou garganta arranhando com frequência Vitaminas e minerais que impactam na sua imunidade Vitamina C e Vitamina D antioxidantes poderosos que auxiliam no funcionamento do sistema imune. Zinco fortalece pele e mucosas, impedindo a entrada de vírus e bactérias. Ômega-3 melhora a integridade das barreiras naturais como o intestino e vias aéreas. Probióticos e Glutamina equilibram a flora intestinal, que está diretamente ligada à nossa imunidade. Inverno e estresse atenção redobrada ReproduçãoFreepik Durante o inverno, passamos mais tempo em ambientes fechados, com menos ventilação e pouca exposição ao sol  o que reduz naturalmente a produção de vitamina D. Ao mesmo tempo, o estresse contínuo da rotina moderna continua, o que compromete o equilíbrio do organismo e pode enfraquecer a resposta imunológica. Nesses períodos de maior exposição a vírus e bactérias, a suplementação estratégica pode atuar como um reforço essencial para manter a imunidade em alta Prevenir é sempre melhor do que remediar Mais do que evitar doenças, uma imunidade fortalecida representa mais disposição, mais vitalidade e mais bem-estar no dia a dia. A suplementação pode contribuir para manter esse equilíbrio, oferecendo suporte nutricional em momentos em que o corpo exige mais  como nas mudanças de estação, em períodos de estresse ou em dietas com baixa variedade. Ficou interessado? CLIQUE AQUI e conheça as melhores opções para reforçar suas defesas de forma prática, segura e eficaz. Juntos, a gente se cuida",https://g1.globo.com/pr/parana/especial-publicitario/maltta-nutrition/noticia/2025/05/22/como-a-suplementacao-pode-ajudar-a-manter-a-imunidade-alta-em-tempos-de-maior-exposicao-a-virus.ghtml,2025-05-22T13:25:17,G1,Brazil,pt
Hiperfarmácia revoluciona conceito de varejo farmacêutico em São José do Rio Preto,"Há seis meses na cidade e com mais de 40 mil produtos e tecnologias inovadoras, a Drogamax se consolida como a maior farmácia da América Latina. Com 2 mil m² e mais de 40 mil itens, Drogamax é a maior farmácia da América Latina DrogamaxDivulgação Há seis meses, desde 9 de novembro de 2024, a cidade de São José do Rio Preto ganhou um novo marco no varejo farmacêutico com a inauguração da Drogamax Hiperfarmácia. Com mais de 2.000 m² de área interna e um mix de mais de 40 mil produtos, a unidade vem se destacando como a maior farmácia da América Latina e está revolucionando a forma como os consumidores compram itens de saúde, beleza e bem-estar A aposta da Drogamax vai além da venda tradicional de medicamentos. A hiperfarmácia investe na diversificação do portfólio, em serviços personalizados e na digitalização da experiência de compra. O objetivo é atender diferentes públicos, desde o infantil até a melhor idade, além de incluir um setor pet e oferecer inovações tecnológicas para facilitar o atendimento ao cliente. A Drogamax impressiona pelo tamanho e pela proposta de ser muito mais que uma farmácia DrogamaxDivulgação A loja foi planejada para oferecer um ambiente amplo e confortável, onde o cliente pode encontrar produtos específicos para diferentes necessidades. No setor infantil, há uma área kids com itens de higiene, nutrição e brinquedos educativos. Já os consumidores que buscam produtos de autocuidado encontram um espaço exclusivo para o público masculino e feminino, com uma linha completa de cosméticos, dermocosméticos e suplementos. Para o público 60, a Drogamax oferece produtos ortopédicos, dispositivos para auxílio na mobilidade e uma variedade de suplementos e vitaminas voltados para a terceira idade. Já para os apaixonados por animais, a farmácia possui um pet shop completo, que inclui medicamentos veterinários, produtos de higiene e alimentação para cães e gatos. Como diferencial, a loja ainda conta com mascotes inusitados, como a jiboia Charles e o ouriço Max, que encantam os clientes durante as compras. Área exclusiva de beleza e bem-estar traz cosméticos, dermocosméticos e suplementos DrogamaxDivulgação A ideia era transformar a farmácia em um verdadeiro centro de bem-estar. Percebemos que o comportamento do consumidor mudou e as farmácias precisavam acompanhar essa evolução. Hoje, as pessoas buscam conveniência e variedade em um só lugar. Por isso, estruturamos a Drogamax para oferecer uma experiência completa, que vai desde o medicamento até o cuidado pessoal e familiar, explica a mentora da empresa, Carla Bittencourt. Aqui todos encontram soluções personalizadas para saúde e bem-estar DrogamaxDivulgação Tecnologia a favor do cliente Além da variedade de produtos, a Drogamax aposta na inovação para melhorar o atendimento ao cliente. Um dos destaques é o Pepe Reception Robot, um robô atendente que interage com os consumidores por meio de inteligência artificial, fornecendo informações sobre produtos e ajudando na navegação dentro da loja. Outro diferencial tecnológico é a balança robô de bioimpedância, que realiza análises detalhadas da composição corporal dos clientes. Esse serviço auxilia no acompanhamento nutricional e na escolha de produtos específicos para cada necessidade de saúde. Setores pensados para cada fase da vida do espaço kids ao público 60 DrogamaxDivulgação De acordo Carla, a implementação dessas tecnologias faz parte do compromisso da Drogamax em oferecer um serviço cada vez mais personalizado e eficiente. Nosso objetivo é que o cliente se sinta bem acolhido e tenha uma experiência diferenciada ao visitar a Drogamax. Com a inteligência artificial, conseguimos agilizar atendimentos e oferecer informações precisas. Além disso, nossa equipe de farmacêuticos está sempre disponível para tirar dúvidas e orientar sobre o uso correto dos produtos, afirma. A loja oferece setores especializados para o público infantil, adulto, 60 e até para pets DrogamaxDivulgação Digitalização A Drogamax também está investindo em sua presença digital para oferecer mais comodidade aos clientes. Além da loja física, a farmácia conta com canais online para consultas de produtos, promoções e conteúdos sobre saúde e bem-estar. Ainda não há informações detalhadas sobre a implementação de e-commerce ou aplicativo, mas a expectativa é que a digitalização continue sendo uma das prioridades da empresa. Outra estratégia adotada é a forte presença nas redes sociais, pelas quais a Drogamax divulga novidades, ofertas e realiza campanhas educativas sobre cuidados com a saúde. O contato com o público não acontece apenas dentro da loja. Utilizamos nossas redes sociais para manter uma comunicação próxima com os clientes, trazendo informações relevantes e criando um relacionamento de confiança, explica a mentora. Beleza em foco o setor de autocuidado reúne cosméticos, dermocosméticos e suplementos em um ambiente acolhedor e moderno DrogamaxDivulgação Com um time de farmacêuticos especializados, a Drogamax reforça seu compromisso com a saúde da população. A equipe está presente em todos os balcões da loja para oferecer atendimento personalizado e tirar dúvidas sobre o uso correto dos medicamentos. Além disso, a hiperfarmácia planeja expandir seus serviços com a oferta de testes rápidos, como os de glicemia e colesterol, e parcerias com laboratórios para a realização de exames de rotina. Queremos ir além da venda de medicamentos. Nossa missão é oferecer bem-estar e qualidade de vida aos nossos clientes. Por isso, estamos sempre buscando novas formas de inovar e trazer serviços que realmente façam a diferença no dia a dia das pessoas, conclui Carla Bittencourt.",https://g1.globo.com/sp/sao-jose-do-rio-preto-aracatuba/especial-publicitario/drogamax/drogamax/noticia/2025/05/22/hiperfarmacia-revoluciona-conceito-de-varejo-farmaceutico-em-sao-jose-do-rio-preto.ghtml,2025-05-22T13:24:33,G1,Brazil,pt
CCR Metrô abre vagas para oficial de manutenção e líder de atendimento em Salvador saiba como se inscrever,"Interessados em participar do processo seletivo podem se inscrever gratuitamente no site da concessionária. CCR Metrô abre vagas para oficial de manutenção e líder de atendimento em Salvador Divulgação A CCR Metrô Bahia abriu inscrições para vagas de emprego como oficial de manutenção e líder de atendimento e manutenção em Salvador. Os interessados em participar do processo seletivo podem se inscrever gratuitamente no site da concessionária, na aba Trabalhe Conosco. Os candidatos têm até segunda-feira 26 para fazer a inscrição voltada à vaga de oficial de manutenção. Já os interessados na oportunidade para líder de atendimento e manutenção, terão até 30 de maio para concluir o cadastro. Para atuar como oficial de manutenção é necessário ter ensino médio completo experiência em manutenções elétricas, mecânicas, eletrônicas e relacionadas ao material rodante trens ter disponibilidade de horário para atuar por escalas diurnas ou noturnas a função também está disponível para Pessoas com Deficiências PcD. Já para o cargo de líder de atendimento e manutenção, estão entre os pré-requisitos ter ensino técnico ou superior completo em uma das seguintes áreas mecânica, elétrica, eletromecânica, eletrotécnica, mecatrônica, eletrônica, automação industrial ou produção ter experiência eou vivência com manutenções em material rodante e o pacote Office básico. Além do salário, os candidatos aprovados na seleção receberão auxílio creche, assistência médica e odontológica, seguro de vida, vale-refeição eou alimentação, folga no dia do aniversário, política de flexibilidade na jornada de trabalho, wellhub, entre outros. LEIA TAMBÉM Prefeitura de Feira de Santana abre 500 vagas para cuidadores escolares com salários de R2 mil veja como se inscrever Curso de formação para cuidadores de idosos abre novas vagas em Salvador saiba como se inscrever Governo da Bahia oferece mais de 2 mil vagas para curso de qualificação para mototaxistas e motofrentistas Veja mais notícias do estado no g1 Bahia. Assista aos vídeos do g1 e TV Bahia",https://g1.globo.com/ba/bahia/blogdoemprego/noticia/2025/05/22/ccr-metro-abre-vagas-para-oficial-de-manutencao-e-lider-de-atendimento-em-salvador-saiba-como-se-inscrever.ghtml,2025-05-22T13:24:10,G1,Brazil,pt
Atendimento presencial de vítimas de fraude no INSS começa no dia 30 veja calendário,"Planejamento foi anunciado nesta manhã. Aposentados e pensionistas poderão ir presencialmente a agências dos Correios em todo o país. O governo anunciou nesta quinta-feira 22 que começará a atender presencialmente aposentados e pensionistas vítimas de fraude no próximo dia 30. O anúncio, antecipado pelo blog, foi confirmado em uma coletiva de imprensa pela manhã. Participaram o ministro da Previdência, Wolney Queiroz, o presidente do INSS, Gilberto Waller e a diretora de governança e estratégia dos Correios, Juliana Agatte. Pelo calendário que foi estudado dentro do governo os Correios recebem nesta quinta 22 o sistema da Dataprev a partir de sexta-feira 23, serão feitos materiais para orientar os idosos na semana que vem, entre os dias 26 e 29, serão testados o sistema e a integração com os Correios  e os funcionários receberão treinamento finalmente, no dia 30 de maio sexta-feira da próxima semana, começa o atendimento presencial. INSS e Correios fecham parceria para atendimento presencial de aposentados e pensionistas",https://g1.globo.com/politica/blog/camila-bomfim/post/2025/05/22/atendimento-presencial-de-aposentados-vitimas-de-fraude-no-inss-deve-comecar-no-dia-30.ghtml,2025-05-22T13:19:38,G1,Brazil,pt
VÍDEOS assista aos melhores momentos do Fórum Diálogos na Educação 2025,Tema da edição foi humanizar para se entender e apresentadora do GNT Elisama Santos ministrou palestra de abertura. Tema da edição foi humanizar para se entender e apresentadora do GNT Elisama Santos ministrou palestra de abertura.,https://g1.globo.com/sp/piracicaba-regiao/educacao/edicao/2025/05/22/videos-assista-aos-melhores-momentos-do-forum-dialogos-na-educacao-2025.ghtml,2025-05-22T13:19:29,G1,Brazil,pt
"Quase 18 da Região Metropolitana de Porto Alegre está em áreas de risco extremo para inundação, aponta estudo","Zonas incluem bairros densamente edificados, apontou artigo publicado em periódico internacional. Em maio de 2024, RS foi atingido por catástrofe climática que deixou 184 mortos e 25 desaparecidos. O Rio Grande do Sul 1 ano depois da enchente que devastou o estado Quase 18 da Região Metropolitana de Porto Alegre está em áreas de risco extremo para inundação. As zonas sob alerta incluem bairros densamente edificados. Os apontamentos constam em um estudo que envolveu pesquisadores ligados ao Centro Nacional de Monitoramento e Alertas de Desastres Naturais Cemaden e ao Instituto de Ciência e Tecnologia da Unesp.  Acesse o canal do g1 RS no WhatsApp Em maio de 2024, o Rio Grande do Sul foi atingido por uma enchente histórica, que provocou danos em quase todos os municípios, devastou cidades, retirou milhares de pessoas de casa e deixou 184 mortos, além de 25 desaparecidos. O nível do Guaíba, em Porto Alegre, chegou a 5,37 metros durante o desastre, de acordo com estimativa do Serviço Geológico do Brasil SGB. Na ocasião, o Instituto de Pesquisas Hídricas IPH da UFRGS apontou que a capital teve 2 mil quarteirões invadidos pela água do Guaíba. Leia também Veja o raio-X da enchente que atingiu o estado Saiba quais leis já estão em vigor no RS desde maio de 2024 Estudante cita enchente em discurso de formatura nos EUA Em Eldorado do Sul, mais de 90 do município foi inundado pelas águas que vieram do Rio Jacuí, segundo as autoridades. Canoas teve ao menos dois terços devastados  o equivalente a uma extensão de quase 11 mil campos de futebol engolidos pela enchente. Os dados reforçam a urgência da implantação de medidas estruturais e não estruturais voltadas para mitigação dos impactos, explicam os estudiosos. Mapa mostra área inundada na Região Metropolitana de Porto Alegre em 6 de maio de 2024 Reprodução Os pesquisadores esclarecem que a combinação de expansão urbana desordenada e eventos climáticos extremos tende a elevar os riscos de desastres. Reforçar a resiliência urbana exige uma abordagem integrada que considere tanto as dinâmicas ambientais quanto as desigualdades sociais que agravam a vulnerabilidade, dizem. Imagem aérea de Canoas, na Região Metropolitana de Porto Alegre, inundada durante enchente Diego VaraReuters E quais são as sugestões? Os cientistas falam em estratégias integradas que vão além da resposta emergencial. Veja as ações recomendadas Fortalecer o planejamento urbano com base em mapas de risco atualizados Restaurar áreas de vegetação natural Modernizar infraestruturas de drenagem urbana Eles destacam ainda que é imprescindível integrar modelagem hidrodinâmica, dados climáticos e sociais em sistemas de alerta precoce que sejam compreensíveis e acessíveis à população. O artigo com os resultados do levantamento foi publicado este mês em um periódico internacional. Museu de Arte do RS durante enchente de maio em Porto Alegre Alan Mendonça FurtadoMargs Números da enchente de 2024 no Rio Grande do Sul Arteg1 Initial plugin text VÍDEOS Tudo sobre o RS",https://g1.globo.com/rs/rio-grande-do-sul/1-ano-de-enchente-rs/noticia/2025/05/22/estudo-enchentes-regiao-metropolitana-risco-extremo-inundacao.ghtml,2025-05-22T13:19:28,G1,Brazil,pt
