title,description,url,published_date,source,country,language
Homem procurado por suspeita de estupro e estupro de vulnerável é detido pela PRF em Salgueiro,"O suspeito foi encaminhado à delegacia da Polícia Civil do município. Delegacia de Salgueiro Reprodução Redes Sociais Um homem procurado por suspeita dos crimes de estupro e estupro de vulnerável foi detido na quarta-feira 21, pela Polícia Rodoviária Federal PRF, na BR 232, em Salgueiro, no Sertão de Pernambuco. Segundo a polícia ele era procurado a partir de um mandado de prisão emitido em abril deste ano de 2025 pela 2ª Vara Mista de Monteiro, na Paraíba. A ação aconteceu enquanto policiais realizavam uma fiscalização no Km 505 da rodovia, quando abordaram um carro ocupado por dois homens. Ao consultar a documentação apresentada pelo motorista, foi descoberto um mandado de prisão com validade até março de 2045. Ainda de acordo com a PRF, o suspeito alegou que poderia ter sido sua enteada e disse que desconhecia as alegações. O homem foi encaminhado à Delegacia de Polícia Civil de Salgueiro, para ser apresentado à justiça. Vídeos mais assistidos do Sertão de PE",https://g1.globo.com/pe/petrolina-regiao/noticia/2025/05/22/homem-procurado-por-suspeita-de-estupro-e-estupro-de-vulneravel-e-detido-pela-prf-em-salgueiro.ghtml,2025-05-22T13:58:32,G1,Brazil,pt
Cerca de 93 dos eleitores do AM estão com biometria digital regularizada saiba como agendar serviço,"Eleitor que ainda não cadastrou a biometria deve agendar o atendimento no site do TRE-AM e comparecer à sede do tribunal ou a um cartório eleitoral. Biometria garante mais segurança ao eleitor no momento da votação. Pedro Amatuzzig1 O Tribunal Regional Eleitoral do Amazonas TRE-AM divulgou que cerca de 93 dos eleitores do estado já estão com o cadastro biométrico regularizado. Os números estão disponíveis para consulta no Painel de Eleitores sem Biometria do órgão, que acompanha o progresso do cadastramento nos 62 municípios do estado. Saiba como agendar serviço.  Participe do canal do g1 AM no WhatsApp O cadastro biométrico é uma tecnologia que confere ainda mais segurança à identificação do eleitor no momento da votação. Segundo o levantamento da Secretaria de Tecnologia da Informação do TRE-AM, 49,2 dos eleitores com biometria registrada são da capital e 43,9 do interior. A presidente do TRE-AM, desembargadora Carla Reis, destacou que a biometria tem papel fundamental na integridade das eleições A biometria eleitoral é uma medida essencial para garantir a segurança, a transparência e a autenticidade do processo democrático. Ela previne fraudes, registros duplicados e dá celeridade ao processo de votação, afirmou. Eleição unificada e mandato de 5 anos os detalhes da PEC que põe fim à reeleição Como fazer o cadastro biométrico O eleitor que ainda não cadastrou a biometria deve agendar o atendimento no site do TRE-AM tre-am.jus.br e comparecer à sede do tribunal ou a um cartório eleitoral. A coleta biométrica é feita durante Alistamento eleitoral primeiro título Revisão de dados cadastrais Transferência de domicílio eleitoral. Quem emitiu o título por meio do Autoatendimento Eleitoral on-line tem um prazo de 30 dias para comparecer presencialmente e concluir o cadastro biométrico. Caso o procedimento não seja feito nesse período, o título será cancelado. O processo inclui a coleta das impressões digitais, fotografia e assinatura digitalizada, garantindo que cada eleitor seja identificado de forma única. Com a biometria registrada, também é possível usar o aplicativo e-Título como documento oficial no dia da eleição. TRE busca mesários no Amazonas",https://g1.globo.com/am/amazonas/noticia/2025/05/22/cerca-de-93percent-dos-eleitores-do-am-estao-com-biometria-digital-regularizada-saiba-como-agendar-servico.ghtml,2025-05-22T13:58:11,G1,Brazil,pt
21ª Expoleste é aberta oficialmente em Governador Valadares com expectativa de superar R 48 milhões em negócios,"Evento reúne mais de 200 empresas no Unicentro e deve atrair cerca de 60 mil visitantes até domingo 25. Expoleste começa em Governador Valadares A 21ª edição da Expoleste foi oficialmente aberta nesta quarta-feira 21 em Governador Valadares, no Vale do Rio Doce. O tradicional corte da fita deu início à maior feira multissetorial do Leste de Minas, em uma cerimônia que reuniu autoridades municipais, políticos e representantes do Governo de Minas Gerais. Antes dos discursos, o público acompanhou a execução do Hino Nacional Brasileiro. O evento é promovido pela Associação Comercial e Empresarial de Governador Valadares ACE-GV com o apoio de diversos parceiros.  Clique aqui para seguir o canal do g1 Vales no WhatsApp Neste ano, a feira ocupa 3 mil metros quadrados do Unicentro, com mais de 150 estandes representando cerca de 200 empresas de diversos setores da economia regional. Ao longo dos cinco dias de evento, a expectativa é de que mais de 60 mil pessoas circulem pelo espaço. Segundo o presidente da ACE-GV, Stefano Coury, a meta é superar o volume de negócios da edição anterior, que foi de R 48 milhões. A gente tem sempre a expectativa de ultrapassar o limite anterior. Queremos passar esse valor e temos quase certeza de que vamos conseguir, afirmou. A feira tem como proposta fomentar a diversificação econômica da região, oferecendo um espaço para conexões empresariais, fechamento de parcerias e apresentação de tendências de mercado. Lucas Pitta, diretor da CODEMG, reforçou a importância do evento para o estado. Muitos veem Minas Gerais como um estado voltado apenas para a mineração, o que é verdade, mas aqui também apoiamos o turismo, a cultura, o lazer, a gastronomia e o pequeno e médio comerciante, destacou. Além dos negócios, a praça de alimentação se tornou ponto de encontro para amigos e famílias, com música ao vivo e uma variedade de sabores da culinária local e regional. A Expoleste segue até domingo 25, a partir de 19h. Vídeos do Leste e Nordeste de Minas Gerais Veja outras notícias da região em g1 Vales de Minas Gerais.",https://g1.globo.com/mg/vales-mg/noticia/2025/05/22/21a-expoleste-e-aberta-oficialmente-em-governador-valadares-com-expectativa-de-superar-r-48-milhoes-em-negocios.ghtml,2025-05-22T13:57:52,G1,Brazil,pt
CrediSIS destaca vivência internacional e intercooperação em intercâmbio na China,"Presidente do Sistema, Otelo Castellani Filho, avaliou participação no programa promovido pela OCBRO como uma oportunidade de transformação estratégica. Lideranças do Sistema CrediSIS integraram a missão técnica na China, com visitas a centros de inovação e experiências voltadas à gestão cooperativa de alto desempenho. AssessoriaCrediSIS O Sistema CrediSIS encerrou, com saldo positivo, a participação na etapa internacional do Programa CEO Alta Gestão do Cooperativismo. A experiência, promovida pelo Sistema OCBRO, levou lideranças de cooperativas rondonienses para uma imersão estratégica na China, passando por importantes centros de tecnologia e inovação nas cidades de Pequim, Hangzhou e Shenzhen. A programação incluiu visitas técnicas a empresas de destaque global, como JD Technology, Alibaba, iFlyTek, Unitree Robotics e Lian Lian Pay, além de atividades acadêmicas no Zhejiang Institute of Economics and Trade ZJITE, instituição reconhecida por sua excelência na formação de executivos em toda a Ásia. O conteúdo abordou temas como inteligência artificial aplicada à gestão, liderança em ambientes de alta performance e estratégias de marketing orientadas por dados. O presidente do Sistema CrediSIS, Otelo Castellani Filho, avaliou a missão como uma das mais enriquecedoras da trajetória da cooperativa. Para ele, o intercâmbio foi além da aprendizagem técnica, oferecendo novas perspectivas sobre cultura organizacional, protagonismo da liderança e inovação com foco em resultados sustentáveis. Participar dessa imersão foi, sem dúvida, um marco na nossa trajetória. Estar na China, diante de empresas líderes em tecnologia e instituições de ensino avançadas, ampliou nosso olhar sobre o futuro do cooperativismo. Trocamos experiências, revisitamos nossas práticas de gestão e voltamos com a certeza de que o desenvolvimento das nossas cooperativas passa, necessariamente, pela inovação com propósito e pela valorização do cooperado em cada decisão estratégica, destacou Otelo. Intercâmbio também promoveu o fortalecimento da intercooperação entre cooperativas rondonienses, ampliando conexões e estratégias conjuntas para o futuro. AssessoriaCrediSIS Além da vivência internacional, a missão também proporcionou um ambiente de troca entre cooperativas que compõem o Sistema OCBRO, reforçando um dos princípios mais importantes do cooperativismo a intercooperação. Durante a programação, representantes de diversas cooperativas rondonienses participaram ativamente das discussões, fortalecendo laços institucionais e construindo pontes para colaborações futuras. A intercooperação é um dos pilares que sustentam o cooperativismo, e vivenciar isso, ao lado de outras cooperativas do nosso estado, foi algo realmente inspirador. Compartilhar ideias, estratégias e desafios fortalece não apenas as instituições envolvidas, mas todo o Sistema OCB. Voltamos com mais conhecimento técnico e com a certeza de que juntos podemos avançar mais rápido e com mais consistência, reforçou o presidente do Sistema CrediSIS. O intercâmbio foi finalizado em Shenzhen, maior polo tecnológico da China, onde os participantes receberam certificados de conclusão em uma cerimônia simbólica. A missão também incluiu vivências culturais, como a cerimônia do chá e visitas à Muralha da China, ao Rio Qiantang e à Praça da Paz Celestial, marcando a integração entre tradição e inovação como pilares da experiência.",https://g1.globo.com/ro/rondonia/especial-publicitario/credisis/credisis-nos-somos-cooperativa/noticia/2025/05/22/credisis-destaca-vivencia-internacional-e-intercooperacao-em-intercambio-na-china.ghtml,2025-05-22T13:57:33,G1,Brazil,pt
Fiscalização do Procon encontra alimentos vencidos há quase 1 ano à venda em Oiapoque,"Diversos produtos do gênero alimentício foram retirados das prateleiras de estabelecimentos do município. Ação faz parte das ações para garantir o direito do consumidor. Operação do Procon em Oiapoque ProconDivulgação Fiscais do Instituto de Defesa do Consumidor Procon-AP encontraram produtos alimentícios vencidos há quase um ano em estabelecimentos de Oiapoque, município distante cerca de 580 quilômetros de Macapá. As fiscalizações ocorrem desde a terça-feira 21 e seguem até a sexta-feira 23. Foram recolhidos das prateleiras produtos congelados, enlatados e embutidos. Em um dos casos, havia um frango congelado vencido há 10 meses. Um pacote de alimento vencido em abril de 2024 também foi encontrado.  Clique aqui para seguir o canal do g1 AP no WhatsApp A operação faz parte das ações para garantir o direito do consumidor na região. Os fiscais estavam cumprindo um requerimento expedido pelo Ministério Público de Oiapoque MP-AP. O objetivo da ação é orientar quanto às normas de defesa do consumidor e fazer com que esses estabelecimentos cumpram o que é determinado em lei. Aqueles produtos que estão sendo recolhidos pela vigilância são produtos impróprios para consumo, então estamos protegendo esse consumidor e orientando o empreendedor sobre a responsabilidade de vender produtos de qualidade, disse Lana Silva, chefe de fiscalização do Procon. Diversos alimentos foram recolhidos ProconDivulgação De acordo com o instituto, os empreendimentos têm 20 dias para apresentar defesa junto ao órgão, além do documento comprobatório do descarte correto dos produtos. Participaram da fiscalização o Procon, a Promotoria de Justiça, a Polícia Civil e a Vigilância Sanitária. Procon encontra produtos vencidos em comércios do município de Oiapoque Fiscais do Procon em Oiapoque ProconDivulgação  Tem uma sugestão de pauta? Fale com o g1 Amapá no WhatsApp Siga as redes sociais do g1 Amapá e Rede Amazônica Instagram, X Twitter e Facebook  Receba no WhatsApp as notícias do g1 Amapá Veja o plantão de últimas notícias do g1 Amapá VÍDEOS com as notícias do Amapá",https://g1.globo.com/ap/amapa/noticia/2025/05/22/fiscalizacao-do-procon-encontra-alimentos-vencidos-ha-quase-1-ano-a-venda-em-oiapoque.ghtml,2025-05-22T13:55:56,G1,Brazil,pt
Incêndio destrói vila de apartamentos e ponto comercial em Porto Velho,"Cachorro que estava em um dos apartamentos morreu carbonizado. As causas do incêndio ainda estão sendo investigadas. Vila de apartamentos pega fogo em Porto Velho Um incêndio destruiu uma vila de apartamentos e parte de um ponto comercial na noite da última quarta-feira 22, em Porto Velho RO. Segundo informações preliminares apuradas pela Rede Amazônica, ninguém ficou ferido, mas um cachorro que estava em um dos apartamentos morreu carbonizado. Veja o vídeo acima As chamas começaram por volta de 20h30 em um dos apartamentos, que fica na parte superior de um comércio, na esquina da Av. Amazonas com a Rua Eduardo Lima e Silva. O fogo rapidamente se alastrou pelos outros cômodos do imóvel.  Siga o canal do g1 RO no WhatsApp. O Corpo de Bombeiros foi chamado e levou cerca de uma hora para controlar as chamas. Uma equipe da Companhia de águas e esgotos de Rondônia Caerd também ajudou a combater o incêndio com 20 mil litros de água. Até o momento, não se tem indícios do que poderia ter causado as chamas. As causas e circunstâncias ainda serão investigadas pelas autoridades. LEIA TAMBÉM PF publica edital com vagas para Rondônia e salários de até R 26,8 mil veja como participar VÍDEO Menina é recebida na escola com balões e cartazes após semanas internada em UTI em RO Incêndio destrói vila de apartamentos em Porto Velho Reprodução Redes Sociais",https://g1.globo.com/ro/rondonia/noticia/2025/05/22/incendio-destroi-vila-de-apartamentos-e-ponto-comercial-em-porto-velho-ro.ghtml,2025-05-22T13:55:28,G1,Brazil,pt
O pilar da inclusão digital em cidades inteligentes,"Como a Internet das Coisas IoT está transformando a conectividade em direito básico e promovendo a inclusão digital nas cidades inteligentes. A tecnologia e a informação desempenham papéis fundamentais no desenvolvimento urbano e bem-estar da população, uma vez que contribuem diretamente com a formação individual, o desenvolvimento econômico e a vida social. Esse tema está cada vez mais presente nas discussões realizadas pelas cidades inteligentes, que entendem a conectividade como um direito básico na vida do cidadão, implantando políticas públicas que garantam a inclusão digital com internet de qualidade e acessível para todos. Bill Furlow, Estrategista Sênior nas áreas de Energia e Automação Industrial, destaca a importância do uso da IoT na educação e a consequência disso para toda a sociedade Assim como a invenção da imprensa, a inclusão digital democratiza a informação. Independentemente da riqueza ou localização física, toda pessoa merece acesso à educação  e isso pode ser viabilizado por meio da conectividade. Uma população bem informada e educada está mais preparada para participar da sociedade  e isso beneficia a todos. Cidades inteligentes têm a conectividade como uma ferramenta básica em diferentes perspectivas. De um lado está a população, que usufrui da tecnologia para suprir as demandas do seu dia a dia, seja na vida pessoal, seja na vida profissional. De outro lado está a própria cidade, que utiliza tecnologia e dados para melhorar a eficiência dos sistemas públicos e garantir melhor qualidade de vida para a população. É aí que a Internet das coisas IoT passa a ser um pilar na inclusão digital das cidades inteligentes, já que a tecnologia permite que dispositivos e sensores interconectados coletem e processem dados, em tempo real, capazes de criar ambientes urbanos mais conectados, como por exemplo, auxiliar na expansão da cobertura da rede, conectando áreas remotas ou menos favorecidas com Wi-FI comunitário. Um exemplo brasileiro dessa tecnologia é São Paulo. A cidade paulistana, uma das maiores do mundo, utiliza sensores de IoT de baixo custo para expandir a conectividade para áreas periféricas através de redes de Wi-FI públicas. Os temas relacionados à organização social urbana, inerentes à pessoas de qualquer classe social, também são beneficiados com a IoT, uma vez que essa tecnologia permite a coleta e gestão de grandes volumes de dados, que são frequentemente utilizados para garantir o acesso à informação e serviços relacionados à saúde, transporte, segurança, educação e processos de governança digital. Esse é o caso de Londres. A capital inglesa implementou sensores IoT para monitoramento do tráfego e integração de dados de mobilidade urbana, o que possibilitou à sua população o acesso, em tempo real, a serviços de transporte público. Não se pode deixar de destacar a relevância da inclusão digital para o desenvolvimento econômico. Sobre isso, Furlow traz uma importante contribuição Em termos práticos, a conectividade gera uma cultura de consumo acelerada. A riqueza é criada e o comércio pode ocorrer muito mais rapidamente no ambiente digital do que quando era limitado a lojas físicas e ao mercado regional. Você, eu, todos nós participamos dessa oportunidade de vender e comprar produtos e serviços para um público muito maior. Ficamos mais bem informados sobre eventos econômicos e mundiais, mais instruídos sobre como aproveitar oportunidades. Tudo isso impulsiona o crescimento econômico, mas também fortalece conexões mais profundas e amplas entre os diferentes grupos sociais. A conectividade não é mais um luxo, ela é essencial. Dentro desse panorama, fica mais do que claro, que a inclusão digital é uma questão de justiça social. Uma tecnologia de necessidade básica, fundamental para a participação social, o acesso à educação, geração de renda e serviços públicos. Em setembro, nos dias 3 e 4, São Paulo irá sediar o IoT Solutions Congress Brasil, um evento que traz reflexões e discussões sobre o tema, reunindo especialistas e soluções que mostram, na prática, como a tecnologia pode ser aplicada não apenas para melhorar a cidade, mas para protegê-la e salvar vidas.",https://g1.globo.com/pr/parana/especial-publicitario/icities-the-smart-cities-hub/noticia/2025/05/22/o-pilar-da-inclusao-digital-em-cidades-inteligentes.ghtml,2025-05-22T13:51:45,G1,Brazil,pt
Governo proíbe venda de mais duas marcas de azeite veja quais,"Marcas Almazara e Escarpas das Oliveiras, que têm como embaladora uma empresa com CNPJ extinto, já haviam sido vetadas pelo Ministério da Agricultura em 2024. Na terça, o governo havia proibido a comercialização de outras duas marcas. Entenda as fraudes de azeite mais comuns no Brasil O governo proibiu, nesta quinta-feira 22, a comercialização, distribuição, fabricação, propaganda e uso de mais duas marcas de azeite Almazara e Escarpas das Oliveiras. A proibição ocorreu após denúncia do Ministério da Agricultura e Pecuária e ação fiscalizatória da Agência Nacional de Vigilância Sanitária Anvisa, que publicou a proibição no Diário Oficial da União desta quinta. Segundo a decisão, os azeites foram proibidos porque têm como embaladora a empresa ORIENTE MERCANTIL IMPORTAÇÃO E EXPORTAÇÃO LTD Super Mercado Oriente, que teve seu CNPJ extinto em novembro de 2023. O g1 não encontrou o contato das marcas, apenas da embaladora. Até a última atualização desta reportagem, a empresa não respondeu ao contato. LISTA veja todas as marcas que tiveram algum veto do governo desde 2024 É a segunda proibição de azeites feita pelo governo federal na semana. Na terça, os azeites das marcas Alonso e Quintas DOliveira também foram vetados pela Anvisa após denúncias do Ministério da Agricultura. Em outubro de 2024, o Ministério da Agricultura realizou apreensões e proibiu a venda de lotes das quatro marcas. Na época, a instituição informou que os produtos apresentavam risco à saúde devido à incerteza sobre a sua origem e composição. Ainda em outubro, Ministério da Agricultura esclareceu que existem duas marcas de azeites chamadas Alonso, mas de empresas diferentes. A primeira é de origem chilena e exportada pela Agrícola Pobena S.A, que é regular. A empresa proibida pelo governo na terça-feira é representada pela Comércio de Gêneros Alimentícios Cotinga Ltda., que tem origem desconhecida. Governo proibiu outras duas marcas de azeite na terça-feira 20 Leia também Azeite fraudado o que fiscais costumam encontrar em frascos adulterados 11 azeites brasileiros entram em guia de melhores do mundo veja lista Ministério da Agricultura dá algumas pistas para encontrar um azeite de qualidade Arteg1 Diferença entre azeite de oliva e outros óleos mais baratos feitos com azeitonas",https://g1.globo.com/economia/agronegocios/noticia/2025/05/22/governo-proibe-venda-de-mais-duas-marcas-de-azeite-veja-quais.ghtml,2025-05-22T13:48:45,G1,Brazil,pt
"Dono de bar é preso suspeito de dopar clientes para manter relações sexuais em Murici, AL","Homem fazia vídeos e enviava em grupos de WhatsApp de conhecidos e também para pessoas de outros estados. Três vítimas foram identificadas até o momento. Homem foi preso no próprio estabelecimento comercial durante cumprimento de mandado. Ascom PC-AL O dono de um bar foi preso nesta quarta-feira 21 na cidade de Murici, interior de Alagoas, suspeito de embebedar e dopar clientes para manter relações sexuais com elas. Ele foi preso por policiais civis e militares no próprio estabelecimento comercial durante cumprimento de mandado de prisão, busca e apreensão. Segundo o delegado Mário Jorge Marinho, os policiais chegaram até o suspeito após a denúncia de uma das vítimas. Na semana passada chegou uma denúncia de estupro. A vítima disse ter sido estuprada, mas não tinha consciência do dia do fato. Foi feito um Boletim de Ocorrência e foram apresentados vários vídeos com outras mulheres na mesma situação. Diante disso foi aberto um inquérito policial e foram feitas investigações para identificar novas vítimas, relatou o delegado. As investigações apontaram que o bar era utilizado pelo suspeito para atrair as vítimas. Lá, ele embebedava e dopava as mulheres. Em seguida, mantinha relações sexuais com elas. Ele ainda filmava e usava as imagens para ameaça-las . Até o momento, três vítimas foram identificadas. Elas foram ouvidas e, durante o depoimento, assistiram aos vídeos gravados pelo dono do bar. As vítimas se reconheceram nas imagens e disseram que não estavam em seu estado normal de consciência. As imagens eram enviadas pelo homem em grupos de WhatsApp de conhecidos e também para pessoas de outros estados, entre eles o Mato Grosso. Violência contra mulher como pedir ajuda Assista aos vídeos mais recentes do g1 AL Veja mais notícias da região no g1 AL",https://g1.globo.com/al/alagoas/noticia/2025/05/22/dono-de-bar-e-preso-suspeito-de-dopar-clientes-para-manter-relacoes-sexuais-em-murici-al.ghtml,2025-05-22T13:47:52,G1,Brazil,pt
