title,description,url,published_date,source,country,language
Pakistan Neues Cybercrime-Gesetz als Waffe gegen Kritiker?,"Pakistans hartes Vorgehen gegen Online-Desinformation ruft Kritik von Menschenrechtsgruppen hervor. Sie fürchten, das neue Gesetz soll kritische Stimmen zum Schweigen bringen.",https://www.dw.com/de/pakistan-neues-cybercrime-gesetz-als-waffe-gegen-kritiker/a-72634522?maca=de-rss-de-all-1119-xml-mrss,2025-05-22T13:43:00,Deutsche Welle,Germany,de
Deutschland stationiert Panzerbrigade an der NATO-Ostflanke,Die Bundeswehr hat in Litauen die neue Panzerbrigade 45 aufgestellt. Zu einem feierlichen Appell reiste Bundeskanzler Friedrich Merz nach Vilnius.,https://www.dw.com/de/deutschland-stationiert-panzerbrigade-an-der-nato-ostflanke/a-72620475?maca=de-rss-de-all-1119-xml-mrss,2025-05-22T13:41:00,Deutsche Welle,Germany,de
Japan investiert trotz klimafreundlicher Versprechen massiv in Flüssigerdgas,"Japan ist weltweit führend bei der Finanzierung von Erdgasprojekten und führt gleichzeitig ein Forum in Asien an, das einen Ausstieg aus fossilen Brennstoffen fordert.",https://www.dw.com/de/japan-investiert-trotz-klimafreundlicher-versprechen-massiv-in-flüssigerdgas/a-72634000?maca=de-rss-de-all-1119-xml-mrss,2025-05-22T13:07:00,Deutsche Welle,Germany,de
Rumänisches Verfassungsgericht weist Wahlanfechtung zurück,Nach seiner Niederlage bei der rumänischen Präsidentschaftswahl scheitert der rechtspopulistische Kandidat George Simion mit einem Antrag auf Annullierung - das Verfassungsgericht entscheidet einstimmig.,https://www.dw.com/de/rumänisches-verfassungsgericht-weist-wahlanfechtung-zurück/a-72634665?maca=de-rss-de-all-1119-xml-mrss,2025-05-22T13:00:00,Deutsche Welle,Germany,de
Israel erhöht Sicherheit an jüdischen Stätten,Zwei Israelis wurden bei einem mutmaßlich antisemitistisch motivierten Angriff in Washington getötet. Israel zeigt sich erschüttert über die Tat. Stärkere Sicherheitsvorkehrungen an den Botschaften sollen folgen.,https://www.dw.com/de/israel-erhöht-sicherheit-an-jüdischen-stätten/a-72633671?maca=de-rss-de-all-1119-xml-mrss,2025-05-22T12:37:00,Deutsche Welle,Germany,de
"Nations League DFB-Kader ohne Havertz, Musiala und Rüdiger","Fußball-Bundestrainer Julian Nagelsmann verzichtet in der Nationalmannschaft für Halbfinale und mögliches Finale der Nations League auf drei Langzeitverletzte, beruft aber zwei Neulinge - einen davon überraschend.",https://www.dw.com/de/nations-league-dfb-kader-ohne-havertz-musiala-und-rüdiger/a-72631693?maca=de-rss-de-all-1119-xml-mrss,2025-05-22T11:07:00,Deutsche Welle,Germany,de
Ukraine fliegt Drohnenangriffe auf Moskau,Die Ukraine meldet weiterhin Kämpfe auf russischem Territorium als Schutzmaßnahme für bedrohte Städte. Der Flugverkehr in Moskau musste wegen Drohnenangriffen gestoppt werden. Die USA bereiten neue Sanktionen vor.,https://www.dw.com/de/ukraine-fliegt-drohnenangriffe-auf-moskau/a-72630040?maca=de-rss-de-all-1119-xml-mrss,2025-05-22T10:16:00,Deutsche Welle,Germany,de
Neuer Oval-Office-Eklat Trump wirft Südafrika Genozid vor,Wieder gab es eine Konfrontation mit einem Gast im Weißen Haus. US-Präsident Trump hat Südafrikas Präsident Ramaphosa mit einer ungewöhnlichen Präsentation überrascht. Sie soll einen Massenmord an Weißen belegen.,https://www.dw.com/de/neuer-oval-office-eklat-trump-wirft-südafrika-genozid-vor/a-72629188?maca=de-rss-de-all-1119-xml-mrss,2025-05-22T09:43:00,Deutsche Welle,Germany,de
Zwei indische Künstlerinnen gehen ihren Weg,Ob Behinderung oder die gesellschaftliche Stellung der Frau Janhavi Khemka und Mayuri Chari verarbeiten in ihrer Kunst eigene Erfahrungen. So unterschiedlich das Resultat - erfolgreich sind beide Künstlerinnen.,https://www.dw.com/de/zwei-indische-künstlerinnen-gehen-ihren-weg/a-72597770?maca=de-rss-de-all-1119-xml-mrss,2025-05-22T09:40:00,Deutsche Welle,Germany,de
Trump scheint das Papstamt zu beeindrucken,"Religion spielt in der US-Politik immer eine große Rolle. Ein Interview zu Donald Trump und JD Vance, zum Glauben in den USA und dem amerikanischen Papst.",https://www.dw.com/de/trump-scheint-das-papstamt-zu-beeindrucken/a-72627141?maca=de-rss-de-all-1119-xml-mrss,2025-05-22T09:38:00,Deutsche Welle,Germany,de
Indien Apple sucht Alternative zu iPhone-Produktion in China,"Apple stützt sich bei der Herstellung seiner Produkte traditionell stark auf chinesische Fabriken. Der Tech-Riese aus Kalifornien plant nun aber, die Produktion in Indien deutlich auszubauen.",https://www.dw.com/de/indien-apple-sucht-alternative-zu-iphone-produktion-in-china/a-72624366?maca=de-rss-de-all-1119-xml-mrss,2025-05-22T09:33:00,Deutsche Welle,Germany,de
Tottenham Hotspur gewinnt Europa League,Nach einer Durststrecke von 17 Jahren sichert sich Tottenham Hotspur wieder einen Titel. Im Finale der Europa League setzen sich die Spurs gegen den englischen Rivalen Manchester United knapp durch.,https://www.dw.com/de/tottenham-hotspur-gewinnt-europa-league/a-72629240?maca=de-rss-de-all-1119-xml-mrss,2025-05-22T09:06:00,Deutsche Welle,Germany,de
News kompakt Angriff auf Mitarbeiter von Israels Botschaft,Nahe dem Jüdischen Museum in Washington sind zwei Menschen erschossen worden. Donald Trump sorgt für einen weiteren internationalen Eklat im Oval Office. Das Wichtigste in Kürze.,https://www.dw.com/de/news-kompakt-angriff-auf-mitarbeiter-von-israels-botschaft/a-72629084?maca=de-rss-de-all-1119-xml-mrss,2025-05-22T07:18:00,Deutsche Welle,Germany,de
Faktencheck Hat China Hilfsgüter über Gaza abgeworfen?,"In Sozialen Medien sind Bilder und Videos aufgetaucht, die angeblich zeigen, wie chinesische Hilfslieferungen per Fallschirm über Gaza abgeworfen werden. Doch die Posts sind falsch.",https://www.dw.com/de/faktencheck-hat-china-hilfsgüter-über-gaza-abgeworfen/a-72625677?maca=de-rss-de-all-1119-xml-mrss,2025-05-22T05:54:00,Deutsche Welle,Germany,de
Das Klima und die neue Regierung Gas statt Wärmepumpen?,Mit Gaskraftwerken und weniger Wärmepumpen will Wirtschaftsministerin Katherina Reiche die Energieversorgung sichern. Klimaaktivisten kritisieren das scharf.,https://www.dw.com/de/das-klima-und-die-neue-regierung-gas-statt-wärmepumpen/a-72610835?maca=de-rss-de-all-1119-xml-mrss,2025-05-22T04:34:00,Deutsche Welle,Germany,de
Golden Dome Trumps Schutzschild gegen Raketen,Bereits in drei Jahren soll das neue US-Raketenabwehrsystem Golden Dome fertig sein - und laut Trump sogar Raketen aus dem All abfangen können. Vorbild ist Israels System. Doch die US-Pläne gehen wesentlich weiter.,https://www.dw.com/de/golden-dome-trumps-schutzschild-gegen-raketen/a-72626453?maca=de-rss-de-all-1119-xml-mrss,2025-05-21T18:22:00,Deutsche Welle,Germany,de
In fünf Tagen auf den Gipfel - erfolgreicher Everest-Kurztrip dank Xenon,Die Besteigung des Mount Everest schrumpft zum Wochentrip. Vier britische Bergsteiger stehen fünf Tage nach ihrem Aufbruch in London auf dem höchsten Punkt der Erde - dank eines neuen umstrittenen Konzeptes.,https://www.dw.com/de/in-fünf-tagen-auf-den-gipfel-erfolgreicher-everest-kurztrip-dank-xenon/a-72624005?maca=de-rss-de-all-1119-xml-mrss,2025-05-21T13:41:00,Deutsche Welle,Germany,de
Deutsche Wirtschaft Wann gehts wieder aufwärts?,"Mit einem Sofortprogramm will die neue Bundesregierung die deutsche Wirtschaft beleben. Doch die Krise ist so gewaltig, dass Wirtschaftsexperten wenig Chancen für einen schnellen Aufschwung sehen.",https://www.dw.com/de/deutsche-wirtschaft-wann-geht-s-wieder-aufwärts/a-72622746?maca=de-rss-de-all-1119-xml-mrss,2025-05-21T13:37:00,Deutsche Welle,Germany,de
EU-Abgeordnete fordern Aussetzen von EU-Geldern für Ungarn,"In einem Brandbrief an die EU-Kommission fordert eine Gruppe von EU-Abgeordneten, dass Ungarn der Geldhahn zugedreht wird. Als Begründung werden Verstöße der ungarischen Regierung gegen EU-Rechte und Werte genannt.",https://www.dw.com/de/eu-abgeordnete-fordern-aussetzen-von-eu-geldern-für-ungarn/a-72623612?maca=de-rss-de-all-1119-xml-mrss,2025-05-21T13:11:00,Deutsche Welle,Germany,de
Der britische Booker Prize geht nach Indien,Die indische Autorin Banu Mushtaq und ihre Übersetzerin Deepa Bhasti gewinnen den renommierten Literaturpreis mit der Kurzgeschichtensammlung Heart Lamp. Sie erzählen von Frauen in Südindien.,https://www.dw.com/de/der-britische-booker-prize-geht-nach-indien/a-72620871?maca=de-rss-de-all-1119-xml-mrss,2025-05-21T11:01:00,Deutsche Welle,Germany,de
Mutmaßliche rechtsextreme Terrorzelle zerschlagen,Mit einer Serie von Razzien ist die Bundesanwaltschaft gegen eine mutmaßliche rechtsextreme Terrorzelle vorgegangen. Die Gruppe soll Anschläge geplant haben. Besonders alarmierend Die Verdächtigen sind sehr jung.,https://www.dw.com/de/mutmaßliche-rechtsextreme-terrorzelle-zerschlagen/a-72619709?maca=de-rss-de-all-1119-xml-mrss,2025-05-21T10:52:00,Deutsche Welle,Germany,de
Faktencheck Hat Joe Biden seine Krebserkrankung vertuscht?,"Nach der offiziellen Diagnose Prostatakrebs wird dem Ex-US-Präsidenten vorgeworfen, er habe seine gesundheitlichen Probleme während seiner Amtszeit verschwiegen. Was ist dran an den Vorwürfen? Ein DW-Faktencheck.",https://www.dw.com/de/faktencheck-hat-joe-biden-seine-krebserkrankung-vertuscht/a-72610826?maca=de-rss-de-all-1119-xml-mrss,2025-05-21T10:43:00,Deutsche Welle,Germany,de
Israel empört EU will Partnerschaftsabkommen prüfen,Die Europäische Union will ein Abkommen mit Israel wegen der Einhaltung von Menschenrechten prüfen. Anlass ist Israels Blockade der Hilfslieferungen in den Gazastreifen. Israel spricht von einem Fehlverständnis.,https://www.dw.com/de/israel-empört-eu-will-partnerschaftsabkommen-prüfen/a-72619036?maca=de-rss-de-all-1119-xml-mrss,2025-05-21T08:51:00,Deutsche Welle,Germany,de
Die US-Regierung möchte an das Geld der Latinos,Rund 160 Milliarden US Dollar wurden im vergangenen Jahr aus den USA an Familien in Lateinamerika überwiesen. Nun könnte ein Teil davon besteuert werden. In Lateinamerika sind die Befürchtungen groß.,https://www.dw.com/de/die-us-regierung-möchte-an-das-geld-der-latinos/a-72591576?maca=de-rss-de-all-1119-xml-mrss,2025-05-21T08:38:00,Deutsche Welle,Germany,de
Isaiah Hartenstein - deutscher NBA-Star mit afroamerikanischen Wurzeln,"Er könnte der zweite deutsche Basketballer nach Dirk Nowitzki werden, der in der besten Liga der Welt triumphiert. Isaiah Hartenstein spielt mit seinem Klub Oklahoma City Thunder im NBA-Halbfinale.",https://www.dw.com/de/isaiah-hartenstein-deutscher-nba-star-mit-afroamerikanischen-wurzeln/a-72610492?maca=de-rss-de-all-1119-xml-mrss,2025-05-21T06:54:00,Deutsche Welle,Germany,de
Mehr Judenhass in Deutschland,Behörden und Experten vermelden einen starken Anstieg antisemitischer Straftaten und Vorfälle. Viele Betroffene fühlen sich alleingelassen.,https://www.dw.com/de/mehr-judenhass-in-deutschland/a-72610068?maca=de-rss-de-all-1119-xml-mrss,2025-05-20T16:45:00,Deutsche Welle,Germany,de
Kommt die EU wie China und Großbritannien zu einem schnellen Handelsdeal mit Trump?,"Was kann die EU aus dem Waffenstillstand im Zollkonflikt zwischen China und Großbritannien mit Donald Trump lernen, um bessere Konditionen auszuhandeln?",https://www.dw.com/de/kommt-die-eu-wie-china-und-großbritannien-zu-einem-schnellen-handelsdeal-mit-trump/a-72610315?maca=de-rss-de-all-1119-xml-mrss,2025-05-20T15:19:00,Deutsche Welle,Germany,de
Hilfslieferungen nach Gaza Tropfen auf den heißen Stein,"Nach fast drei Monaten Blockade erlaubt Israel wieder Hilfsgüterlieferungen in den Gazastreifen. Viel zu wenig, sagen Hilfsorganisationen und die UN. Indes bestellt Großbritannien die israelische Botschafterin ein.",https://www.dw.com/de/hilfslieferungen-nach-gaza-tropfen-auf-den-heißen-stein/a-72609792?maca=de-rss-de-all-1119-xml-mrss,2025-05-20T14:24:00,Deutsche Welle,Germany,de
Tierischer Trend Kapuzineraffen entführen Brüllaffenbabys,"Auf einer Insel in Panama entführen Kapuzineraffen Brüllaffenbabys und tragen sie tagelang mit sich herum  aus Langeweile. Forschende vermuten dahinter einen bizarren Trend, der für die entführten Babys tödlich endet.",https://www.dw.com/de/tierischer-trend-kapuzineraffen-entführen-brüllaffenbabys/a-72607582?maca=de-rss-de-all-1119-xml-mrss,2025-05-20T13:31:00,Deutsche Welle,Germany,de
"Ein Theatermacher, eine Oper und der Holocaust in Rumänien","Erwin Simsensohn ist Intendant, Regisseur, Vater und Jude. Nun hat er in Bukarest eine Oper über den Holocaust und den Eichmann-Prozess von 1961 inszeniert. Ein Treffen mit einem Kulturschaffenden, der erinnern möchte.",https://www.dw.com/de/ein-theatermacher-eine-oper-und-der-holocaust-in-rumänien/a-72604604?maca=de-rss-de-all-1119-xml-mrss,2025-05-20T12:52:00,Deutsche Welle,Germany,de
Neue EU-Sanktionen gegen Russland Schattentanker im Visier,"Fast 300 Schiffe, die zur russischen Schattenflotte gehören sollen, listet das jüngste Sanktionspaket der EU auf. Doch können die Sanktionen den russischen Handel mit Öl tatsächlich eindämmen?",https://www.dw.com/de/neue-eu-sanktionen-gegen-russland-schattentanker-im-visier/a-72606936?maca=de-rss-de-all-1119-xml-mrss,2025-05-20T12:19:00,Deutsche Welle,Germany,de
Trump Putin will das Blutbad in der Ukraine beenden,"Nach einem Telefonat mit dem russischen Präsidenten Putin ist der US-Präsident überzeugt, dass es eine Chance für Frieden in der Ukraine gibt. Die europäischen Partner sind skeptisch und handeln.",https://www.dw.com/de/trump-putin-will-das-blutbad-in-der-ukraine-beenden/a-72603954?maca=de-rss-de-all-1119-xml-mrss,2025-05-20T10:41:00,Deutsche Welle,Germany,de
Trump und Putin Dröhnende Leere nach Ukraine-Gespräch,Zum dritten Mal seit seinem Amtsantritt hat US-Präsident Trump mit Russlands Staatschef Putin telefoniert. Die Ergebnisse interpretieren beide unterschiedlich. Stecken die Ukraine-Verhandlungen in einer Sackgasse?,https://www.dw.com/de/trump-und-putin-dröhnende-leere-nach-ukraine-gespräch/a-72603311?maca=de-rss-de-all-1119-xml-mrss,2025-05-20T09:14:00,Deutsche Welle,Germany,de
USA Gesetz gegen Rachepornos in Kraft,In den Vereinigten Staaten ist das Veröffentlichen intimer Aufnahmen ohne Zustimmung der Gezeigten künftig verboten. Auch mit Künstlicher Intelligenz KI erstellte Bilder sind betroffen.,https://www.dw.com/de/usa-gesetz-gegen-rachepornos-in-kraft/a-72604184?maca=de-rss-de-all-1119-xml-mrss,2025-05-20T08:49:00,Deutsche Welle,Germany,de
"Faktencheck Hey, Grok, stimmt das? Wie zuverlässig sind KI-Chatbots?","Immer mehr Menschen nutzen KI-Chatbots, um Informationen schnell zu überprüfen. Doch wie genau und zuverlässig sind die Antworten von Grok, Meta AI, ChatGPT  Co?",https://www.dw.com/de/faktencheck-hey-grok-stimmt-das-wie-zuverlässig-sind-ki-chatbots/a-72596779?maca=de-rss-de-all-1119-xml-mrss,2025-05-20T08:27:00,Deutsche Welle,Germany,de
USA-Südafrika Werden Ramaphosa und Trump die Wogen glätten?,Südafrikas Präsident Cyril Ramaphosa trifft Donald Trump in Washington. Sie wollen über Handelsabkommen sprechen. Aber können die Verstimmungen über Trumps Vorwürfe eines weißen Genozids in Südafrika beigelegt werden?,https://www.dw.com/de/usa-südafrika-werden-ramaphosa-und-trump-die-wogen-glätten/a-72609807?maca=de-rss-de-all-1119-xml-mrss,2025-05-20T07:00:00,Deutsche Welle,Germany,de
Wie KI Japans Animationsindustrie verändert,Künstliche Intelligenz krempelt Japans Animationsfilmindustrie um - dank technikfreundlicher Gesetze. Der Einsatz von KI im Film ist aber längst ein weltweiter Trend.,https://www.dw.com/de/wie-ki-japans-animationsindustrie-verändert/a-72566510?maca=de-rss-de-all-1119-xml-mrss,2025-05-20T06:25:00,Deutsche Welle,Germany,de
Deutschland will Familiennachzug für Geflüchtete aussetzen,In den nächsten zwei Jahren sollen Flüchtlinge mit subsidiärem Schutz keine Angehörigen mehr nach Deutschland holen dürfen. Die Pläne der neuen schwarz-roten Bundesregierung betreffen vor allem Menschen aus Syrien.,https://www.dw.com/de/deutschland-will-familiennachzug-für-geflüchtete-aussetzen/a-72597511?maca=de-rss-de-all-1119-xml-mrss,2025-05-19T16:03:00,Deutsche Welle,Germany,de
Frauen im Iran Staat kann Veränderung nicht aufhalten,Trotz staatlicher Repression wächst der Widerstand der Frauen gegen den Kopftuchzwang. Das Regime im Iran scheint machtlos gegen den gesellschaftlichen Wandel.,https://www.dw.com/de/frauen-im-iran-staat-kann-veränderung-nicht-aufhalten/a-72591748?maca=de-rss-de-all-1119-xml-mrss,2025-05-19T11:35:00,Deutsche Welle,Germany,de
"Prostatakrebs 10 Sekunden, die Leben retten können",Viele Männer haben mit zunehmendem Alter Probleme mit der Prostata. Zu wenige gehen zur Vorsorge. Dabei kann die Leben retten.,https://www.dw.com/de/prostatakrebs-10-sekunden-die-leben-retten-können/a-62686516?maca=de-rss-de-all-1119-xml-mrss,2025-05-19T11:17:00,Deutsche Welle,Germany,de
Syrien-Sanktionen Wie eine Lockerung den Libanon beträfe,Eine Lockerung der Sanktionen der USA gegen Syrien könnte dem Libanon neue Chancen eröffnen. Präsident Joseph Aoun hofft auf eine wirtschaftliche Sanierung und vor allem die Rückkehr syrischer Flüchtlinge.,https://www.dw.com/de/syrien-sanktionen-wie-eine-lockerung-den-libanon-beträfe/a-72583216?maca=de-rss-de-all-1119-xml-mrss,2025-05-18T17:44:00,Deutsche Welle,Germany,de
Wie Malcolm X gegen den amerikanischen Alptraum kämpfte,"Weiße waren für ihn Teufel, und Gewalt sah er als probates Mittel, um sich gegen die Unterdrückung der Schwarzen in den USA zu wehren. Bis heute ist Malcolm X eine Ikone der schwarzen Bürgerrechtbewegung.",https://www.dw.com/de/wie-malcolm-x-gegen-den-amerikanischen-alptraum-kämpfte/a-72545189?maca=de-rss-de-all-1119-xml-mrss,2025-05-18T15:11:00,Deutsche Welle,Germany,de
Wie Malis Militärherrschaft die Demokratie aushöhlt,"Malis Militärjunta hat alle politischen Parteien verboten, abweichende Meinungen zum Schweigen gebracht und Wahlen verschoben. Analysten sehen die demokratische Zukunft des Landes in Gefahr.",https://www.dw.com/de/wie-malis-militärherrschaft-die-demokratie-aushöhlt/a-72568366?maca=de-rss-de-all-1119-xml-mrss,2025-05-18T13:56:00,Deutsche Welle,Germany,de
"PFAS Helfen Müsli, Obst und Gemüse gegen die Umweltgifte?","In Regenjacken, Pizzakartons, Trinkwasser und in unserem Blut PFAS sind überall. Die Ewigkeits-Chemikalien können Krebs und Organschäden verursachen. Ballaststoffe könnten unserem Körper helfen, sie loszuwerden.",https://www.dw.com/de/pfas-helfen-müsli-obst-und-gemüse-gegen-die-umweltgifte/a-72558071?maca=de-rss-de-all-1119-xml-mrss,2025-05-18T13:48:00,Deutsche Welle,Germany,de
Terrorakt nahe Fruchtbarkeitsklinik in Kalifornien,"Eine heftige Explosion rüttelte Bewohner der südkalifornischen Stadt Palm Springs auf. Die genauen Hintergründe sind noch unklar, doch die US-Bundespolizei FBI ist sich schon ziemlich sicher.",https://www.dw.com/de/terrorakt-nahe-fruchtbarkeitsklinik-in-kalifornien/a-72579065?maca=de-rss-de-all-1119-xml-mrss,2025-05-18T06:45:00,Deutsche Welle,Germany,de
Segelschulschiff rammt Brooklyn Bridge in New York,Vor den Augen entsetzter Passanten hat ein Segelschulschiff der mexikanischen Marine die weltberühmte Brooklyn Bridge in New York gerammt. Zwei Menschen starben.,https://www.dw.com/de/segelschulschiff-rammt-brooklyn-bridge-in-new-york/a-72579066?maca=de-rss-de-all-1119-xml-mrss,2025-05-18T06:40:00,Deutsche Welle,Germany,de
ESC 2025 JJ aus Österreich feiert Finalsieg,Der junge Countertenor gewann den diesjährigen Eurovision Song Contest mit der Pop-Oper Wasted Love. Deutschland landete in Basel mit Baller von Abor  Tynna im Mittelfeld.,https://www.dw.com/de/esc-2025-jj-aus-österreich-feiert-finalsieg/a-72578840?maca=de-rss-de-all-1119-xml-mrss,2025-05-18T05:04:00,Deutsche Welle,Germany,de
Trump und Netanjahu - ehemals beste Freunde?,"Während Donald Trump in den Golfstaaten Geschäfte macht und einen Waffenstillstand mit den Huthi im Jemen aushandelt, sieht Benjamin Netanjahu von der Seitenlinie zu. Was läuft schief zwischen Israels und den USA?",https://www.dw.com/de/trump-und-netanjahu-ehemals-beste-freunde/a-72576928?maca=de-rss-de-all-1119-xml-mrss,2025-05-17T19:32:00,Deutsche Welle,Germany,de
UN prangern neue Großoffensive Israels im Gazastreifen an,"Israel zeigt sich fest entschlossen, die radikalislamische Hamas mit voller Kraft zu zerschlagen. Der oberste Menschenrechtler der Vereinten Nationen bewertet das Vorgehen der israelischen Armee mit drastischen Worten.",https://www.dw.com/de/un-prangern-neue-großoffensive-israels-im-gazastreifen-an/a-72574496?maca=de-rss-de-all-1119-xml-mrss,2025-05-17T10:41:00,Deutsche Welle,Germany,de
"Glitter, Glamour, Politik der ESC vor der Endrunde","Der Eurovision Song Contest ESC geht auf die Zielgerade Nach der zweiten Zwischenrunde stehen die 26 ESC-Finalisten fest. Die große Show am Samstagabend verspricht Glanz und Glamour, hat aber weiter Konfliktpotential.",https://www.dw.com/de/glitter-glamour-politik-der-esc-vor-der-endrunde/a-72564159?maca=de-rss-de-all-1119-xml-mrss,2025-05-16T16:32:00,Deutsche Welle,Germany,de
Wie entwickelt sich die sexuelle Orientierung?,"Sexualität ist vielfältig. Zu welchem Geschlecht man sich hingezogen fühlt, entscheidet sich in der Pubertät. Ein Zusammenspiel aus biologischen und psychosozialen Faktoren ist entscheidend.",https://www.dw.com/de/wie-entwickelt-sich-die-sexuelle-orientierung/a-72564521?maca=de-rss-de-all-1119-xml-mrss,2025-05-16T13:13:00,Deutsche Welle,Germany,de
Zu wenig Regen Was tun gegen Dürre in Deutschland?,"Selten war es im Frühjahr so trocken wie 2025. Landwirtschaft, Grundwasser und sogar Verbraucherpreise leiden darunter, Pflanzen und Ökosysteme geraten frühzeitig unter Stress. Was kann man dagegen tun?",https://www.dw.com/de/zu-wenig-regen-was-tun-gegen-dürre-in-deutschland/a-72555373?maca=de-rss-de-all-1119-xml-mrss,2025-05-16T11:26:00,Deutsche Welle,Germany,de
125 Jahre Popkultur Die Zauberfarben von OZ,Von essbaren Farben bis Technicolor-Tricks Die Story des Zauberers von OZ ist auch eine Geschichte der Farben. Welche Akzente der Popkultur-Klassiker setzte.,https://www.dw.com/de/125-jahre-popkultur-die-zauberfarben-von-oz/a-72557355?maca=de-rss-de-all-1119-xml-mrss,2025-05-16T10:38:00,Deutsche Welle,Germany,de
Eklat bei FIFA-Kongress Riss zwischen Gianni Infantino und der UEFA,"Vertreter der UEFA verlassen vorzeitig den FIFA-Kongress in Paraguay, weil Gianni Infantino verspätet anreist. Die Europäer sehen im Verhalten des FIFA-Präsidenten einen Affront.",https://www.dw.com/de/eklat-bei-fifa-kongress-riss-zwischen-gianni-infantino-und-der-uefa/a-72562270?maca=de-rss-de-all-1119-xml-mrss,2025-05-16T10:15:00,Deutsche Welle,Germany,de
Bundesliga-Rekordschiedsrichter Felix Brych geht in Rente,Nach 359 Bundesligaspielen verabschiedet sich einer von Deutschlands erfahrensten Schiedsrichtern. Brych hat viele Höhen erlebt - mit Phantomtor und Kreuzbandriss aber auch einige Tiefen.,https://www.dw.com/de/bundesliga-rekordschiedsrichter-felix-brych-geht-in-rente/a-72558746?maca=de-rss-de-all-1119-xml-mrss,2025-05-16T08:34:00,Deutsche Welle,Germany,de
Ukraine erwägt Bindung ihrer Währung an Euro statt US-Dollar,"In der Ukraine werden die Überlegungen laut, den US-Dollar als Referenzwährung durch den Euro zu ersetzen. Welche Vor- und Nachteile könnten sich für die Wirtschaft ergeben und wie schnell wäre die Idee umsetzbar?",https://www.dw.com/de/ukraine-erwägt-bindung-ihrer-währung-an-euro-statt-us-dollar/a-72554653?maca=de-rss-de-all-1119-xml-mrss,2025-05-15T13:53:00,Deutsche Welle,Germany,de
Deutschland und Israel Steinmeiers schwieriger Besuch bei Freunden,"Deutschland und Israel würdigen ihre 60-jährigen Beziehungen mit gegenseitigen Visiten. Israels Präsident Herzog war in Berlin, Bundespräsident Steinmeier in Jerusalem. Beides sind keine einfachen Begegnungen.",https://www.dw.com/de/deutschland-und-israel-steinmeiers-schwieriger-besuch-bei-freunden/a-72549720?maca=de-rss-de-all-1119-xml-mrss,2025-05-15T13:41:00,Deutsche Welle,Germany,de
Afghanistan Kein Platz für Vielfalt unter den Taliban,"Frauenrechte, kulturelle und religiöse Pluralität werden immer weiter eingeschränkt. Die Taliban dulden kaum etwas außerhalb ihrer religiösen und ethnischen Ordnung. Doch Abschiebungen nach Afghanistan gehen weiter.",https://www.dw.com/de/afghanistan-kein-platz-für-vielfalt-unter-den-taliban/a-72550563?maca=de-rss-de-all-1119-xml-mrss,2025-05-15T11:23:00,Deutsche Welle,Germany,de
Trendsport Die Ninjas erobern Deutschland,"Spektakuläre Sprünge, waghalsige Hindernisse - der Ninja-Sport verlangt den Athletinnen und Athleten alles ab. Vor allem Kinder sind begeistert und machen den etablierten Ninjas Konkurrenz.",https://www.dw.com/de/trendsport-die-ninjas-erobern-deutschland/a-72536269?maca=de-rss-de-all-1119-xml-mrss,2025-05-15T08:13:00,Deutsche Welle,Germany,de
Cognac in der Krise Frankreichs Exportschlager zwischen Handelskonflikt und Klimawandel,"Cognac aus Frankreich gilt als der edelste Traubenschnaps der Welt. 98 Prozent der Produktion wird in über 150 Länder exportiert. Inzwischen kämpfen die Produzenten mit Zöllen, Absatzrückgängen und Klimawandel.",https://www.dw.com/de/cognac-in-der-krise-frankreichs-exportschlager-zwischen-handelskonflikt-und-klimawandel/a-72512828?maca=de-rss-de-all-1119-xml-mrss,2025-05-15T07:14:00,Deutsche Welle,Germany,de
Kanye West Nazi-Symbole und die Macht der Plattformen,"Kanye West sorgt mit Nazi-Referenzen in seinem neuen Song für Empörung. Warum das Video in Deutschland verboten ist, in den USA aber nicht  und was das über Social Media und Meinungsfreiheit verrät.",https://www.dw.com/de/kanye-west-nazi-symbole-und-die-macht-der-plattformen/a-72539197?maca=de-rss-de-all-1119-xml-mrss,2025-05-14T13:12:00,Deutsche Welle,Germany,de
