title,description,url,published_date,source,country,language
"Hyderabad Metro Rail  DPRs finalised for JBS-Medchal, JBS-Shameerpet,  RGIA - Future City corridors","The 86.1 km route under Phase 2B is estimated to cost 19,579 crore",https://www.thehindu.com/news/cities/Hyderabad/hyderabad-metro-rail-dprs-finalised-for-jbs-medchal-jbs-shameerpet-rgia-future-city-corridors/article69605805.ece,2025-05-22T17:50:21,The Hindu,India,en
Reference to a Tamil book deciphered from a stone inscription,,https://www.thehindu.com/news/cities/Tiruchirapalli/reference-to-a-tamil-book-deciphered-from-a-stone-inscription/article69606029.ece,2025-05-22T17:43:08,The Hindu,India,en
PF Near You on May 27,,https://www.thehindu.com/news/cities/Tiruchirapalli/pf-near-you-on-may-27/article69606033.ece,2025-05-22T17:34:05,The Hindu,India,en
Muthupettai police book BJP leaders for hate speech,,https://www.thehindu.com/news/cities/Tiruchirapalli/muthupettai-police-book-bjp-leaders-for-hate-speech/article69605894.ece,2025-05-22T17:27:50,The Hindu,India,en
India-Pakistan understanding on cessation of hostilities reached bilaterally Jaishankar,"The cessation of firing and military action was something which was negotiated directly between India and Pakistan, says EAM S. Jaishankar",https://www.thehindu.com/news/national/india-pakistan-understanding-on-cessation-of-hostilities-reached-bilaterally-jaishankar/article69605957.ece,2025-05-22T17:26:18,The Hindu,India,en
Death toll in Sengipatti road accident rises to six,All the victims were travelling by a van to Velankanni from Bengaluru when the accident occurred at Sengipatti on Nagapattinam-Tiruchi Highway in Thanjavur district on Wednesday night,https://www.thehindu.com/news/cities/Tiruchirapalli/death-toll-in-sengipatti-road-accident-rises-to-six/article69605897.ece,2025-05-22T17:21:38,The Hindu,India,en
"Month after massacre of tourists, Pahalgam locals count livelihood losses","Pahalgam had not worn such a deserted look even at the peak of the early 1990s insurgency, said tour operator Nasir Ahmad",https://www.thehindu.com/news/national/jammu-and-kashmir/month-after-massacre-of-tourists-pahalgam-locals-count-livelihood-losses/article69605653.ece,2025-05-22T17:13:02,The Hindu,India,en
MysuruKushalnagar highway project finally on track after long delays,"The new highway is anticipated to substantially reduce travel time between Bengaluru and Kushalnagar, which in turn will benefit travellers heading further west to Madikeri and Mangaluru.",https://www.thehindu.com/news/national/karnataka/mysurukushalnagar-highway-project-finally-on-track-after-long-delays/article69605782.ece,2025-05-22T16:59:27,The Hindu,India,en
"SixUnited, Resolute Group ink pact to jointly manufacture tablets, PCs and laptops in Telangana",,https://www.thehindu.com/news/cities/Hyderabad/sixunited-resolute-group-ink-pact-to-jointly-manufacture-tablets-pcs-and-laptops-in-telangana/article69605597.ece,2025-05-22T16:51:41,The Hindu,India,en
Bengaluru rains Pre-monsoon showers fill 63 lakes to capacity,"According to data released by BBMP on May 21, 19 lakes in Yelahanka zone are filled to capacity",https://www.thehindu.com/news/cities/bangalore/bengaluru-rains-pre-monsoon-showers-fill-63-lakes-to-capacity/article69605558.ece,2025-05-22T16:51:34,The Hindu,India,en
UAE reaffirms its unwavering support for India in global fight against terrorism,"Terrorism is an enemy of humanity. Wise people should rise and speak against it, says Ali Rashid Al Nuaimi, Chairman of the Defence Affairs, Interior  Foreign Affairs Committee",https://www.thehindu.com/news/national/uae-reaffirms-its-unwavering-support-for-india-in-global-fight-against-terrorism/article69605791.ece,2025-05-22T16:41:46,The Hindu,India,en
Thunderstorms alert in all Telangana districts till May 26 Highest temperature down to less than 40C,,https://www.thehindu.com/news/national/telangana/thunderstorms-alert-in-all-telangana-districts-till-may-26-highest-temperature-down-to-less-than-40c/article69605334.ece,2025-05-22T16:38:21,The Hindu,India,en
"CoBRA commando, Maoist killed in Chhattisgarh operation",The operation is being led by the 210th battalion of CRPFs CoBRA and has troops from Chhattisgarh Police DRG and STF,https://www.thehindu.com/news/national/chhattisgarh/cobra-commando-maoist-killed-in-chhattisgarh-operation/article69605545.ece,2025-05-22T16:22:33,The Hindu,India,en
Four-year-old discovers new fish in Kerala Green Humour by Rohan Chakravarty,,https://www.thehindu.com/sci-tech/energy-and-environment/four-year-old-discovers-new-fish-in-kerala-green-humour-rohan-chakravarty/article69596447.ece,2025-05-22T16:12:47,The Hindu,India,en
Hyderabads Shilparamam turns global village as Miss World 2025 contestants experience Telanganas living traditions,,https://www.thehindu.com/news/cities/Hyderabad/hyderabads-shilparamam-turns-global-village-as-miss-world-2025-contestants-experience-telanganas-living-traditions/article69605570.ece,2025-05-22T16:09:54,The Hindu,India,en
ASI asks archaeologist Amarnath Ramakrishna to rewrite his report on Keezhadi excavations,"A letter from the ASI said two experts had suggested corrections in the report submitted by Mr. Ramakrishna, who was in charge of the excavation, to make it more authentic.",https://www.thehindu.com/news/national/tamil-nadu/archaeological-survey-of-india-asks-amarnath-ramakrishna-to-rewrite-his-report-on-keezhadi-excavations/article69605593.ece,2025-05-22T16:08:42,The Hindu,India,en
Average mandi prices of major food crops ruling below MSP RBI article,"Mandi prices of major food crops are below MSP due to a bumper harvest, with easing prices and a positive outlook for food security",https://www.thehindu.com/business/Economy/average-mandi-prices-of-major-food-crops-ruling-below-msp-rbi-article/article69605513.ece,2025-05-22T16:05:04,The Hindu,India,en
Punjab and Haryana High Court receives bomb threat mail police launch search,"An e-mail was sent to the registrars office of the High Court, claiming that an IED had been planted in the complex. On being informed, police launched a thorough search, Chandigarh Police official said",https://www.thehindu.com/news/national/punjab/punjab-and-haryana-high-court-receives-bomb-threat-mail-police-launch-search/article69605660.ece,2025-05-22T16:02:43,The Hindu,India,en
Supreme Court directs NHAI to take effective steps to curb unauthorised occupation of highways,"The Supreme Court also directed the Centre to give wide publicity to the availability of Rajmargyatra mobile application on print, electronic, as well as social media",https://www.thehindu.com/news/national/supreme-court-directs-nhai-to-take-effective-steps-to-curb-unauthorised-occupation-of-highways/article69605410.ece,2025-05-22T16:00:34,The Hindu,India,en
NH-66 collapse in Kerala Centre debars construction and consultancy firms involved,Centre also brings two company officials under the ambit of its ongoing inquiry into collapse of highway stretch,https://www.thehindu.com/news/national/kerala/nh-66-collapse-in-kerala-centre-debars-construction-and-consultancy-firms-involved/article69605631.ece,2025-05-22T15:57:38,The Hindu,India,en
"T.N. police attempting to cover up Arakkonam sexual harassment case, alleges BJPs L. Murugan","Mr. Murugan said In both the Anna University sexual assault case and the Arakkonam case, DMK functionaries were involved",https://www.thehindu.com/news/national/tamil-nadu/tn-police-attempting-to-cover-up-arakkonam-sexual-harassment-case-alleges-bjps-l-murugan/article69605547.ece,2025-05-22T15:38:15,The Hindu,India,en
Tamil Nadu Sand Lorry Owners Associations proposed indefinite strike withdrawn,The proposed strike was withdrawn after Minister for Natural Resources S. Regupathy assured the association that he would take up their issues with CM Stalin,https://www.thehindu.com/news/cities/Coimbatore/tamil-nadu-sand-lorry-owners-associations-proposed-indefinite-strike-withdrawn/article69605414.ece,2025-05-22T15:25:35,The Hindu,India,en
"Kerala Plus Two Class 12 results announced, pass rate 77.81",4.44 lakh students registered for 2025 Plus Two examination held in March,https://www.thehindu.com/news/national/kerala/kerala-plus-two-class-12-results-2025/article69605110.ece,2025-05-22T15:22:11,The Hindu,India,en
Telangana Deputy CM seeks cooperation of banks to achieve Rajiv Yuva Vikasam targets,"Govt earmarked 6,250 crore for the scheme, to distribute sanction letters to five lakh youth on June 2",https://www.thehindu.com/news/national/telangana/telangana-deputy-cm-seeks-cooperation-of-banks-to-achieve-rajiv-yuva-vikasam-targets/article69605370.ece,2025-05-22T14:58:57,The Hindu,India,en
"Fresh COVID-19 case detected in Odisha after two-and-a-half years, patient stable","The situation is completely under control and there is no need to worry, says Health and Family Welfare Secretary S. Aswathy",https://www.thehindu.com/news/national/odisha/fresh-covid-19-case-detected-in-odisha-after-two-and-a-half-years-patient-stable/article69605368.ece,2025-05-22T14:45:41,The Hindu,India,en
