title,description,url,published_date,source,country,language
US officials e-mail on gang assessment sparks concern inside intel agencies,The e-mail acknowledged that the Venezuelan government may not have specifically directed the activities of a gang.,https://www.straitstimes.com/world/united-states/us-officials-e-mail-on-gang-assessment-sparks-concern-inside-intel-agencies,2025-05-21T05:19:58,The Straits Times,Singapore,en
"Trump picks design for 226b Golden Dome missile defence shield, appoints project leader",The system is aimed at blocking missile threats from China and Russia.,https://www.straitstimes.com/world/united-states/trump-picks-design-for-200b-golden-dome-missile-defence-shield-names-project-leader,2025-05-21T05:07:51,The Straits Times,Singapore,en
US judge orders Trump administration to keep custody of migrants sent to South Sudan,BOSTON - A federal judge on Tuesday ordered the Trump administration to not let a group of migrants being flown to South Sudan leave the custody of U.S. immigration authorities after saying they appeared to have been deported in violation of a court order.,https://www.straitstimes.com/world/united-states/us-judge-orders-trump-administration-to-keep-custody-of-migrants-sent-to-south-sudan,2025-05-21T04:54:57,The Straits Times,Singapore,en
Italian PM says Pope confirmed willingness to host Ukraine peace talks,Newly elected Pope Leo has said the Vatican could act as a mediator in global conflicts.,https://www.straitstimes.com/world/europe/italy-pm-says-pope-confirmed-willingness-to-host-ukraine-peace-talks,2025-05-21T04:49:57,The Straits Times,Singapore,en
Donors pledge over 220m to WHO ahead of US exit,"Countries also accepted higher fees to help offset the expected loss of the US, the top donor.",https://www.straitstimes.com/world/europe/donors-pledge-over-200m-to-who-ahead-of-us-exit,2025-05-21T04:24:59,The Straits Times,Singapore,en
Poll shows Trumps approval rating ticks lower as economic concerns weigh on Americans,His high point remains his 47 per cent rating in the hours after his return to the White House in January.,https://www.straitstimes.com/world/united-states/trumps-approval-rating-ticks-lower-economic-concerns-weigh-reutersipsos-poll-finds,2025-05-21T04:20:12,The Straits Times,Singapore,en
Rubio may have revoked thousands of visas as crackdown continues,Marco Rubio said he believed there was still more to do.,https://www.straitstimes.com/world/united-states/rubio-may-have-revoked-thousands-of-visas-as-crackdown-continues,2025-05-21T04:10:06,The Straits Times,Singapore,en
Pentagon chief orders comprehensive review into 2021 US Afghanistan withdrawal,It was unclear how Mr Hegseths review would differ from many previous reviews that were carried out.,https://www.straitstimes.com/world/united-states/pentagon-chief-orders-comprehensive-review-into-2021-us-afghanistan-withdrawal,2025-05-21T03:54:56,The Straits Times,Singapore,en
Evo Morales out of Bolivian presidential race as candidate deadline expires,"LA PAZ - The registration window for candidates hoping to compete for Bolivias presidency in its August election expired on Tuesday, drawing a line under ex-President Evo Morales attempt at a fourth presidential term.",https://www.straitstimes.com/world/evo-morales-out-of-bolivian-presidential-race-as-candidate-deadline-expires,2025-05-21T03:50:06,The Straits Times,Singapore,en
"French, German leaders call on EU to scrap supply chain audit law","BERLINBRUSSELS - The leaders of France and Germany have called on the European Union to scrap its new supply chain audit law, worried that it could hurt the blocs ability to compete economically with the U.S. and China.",https://www.straitstimes.com/world/europe/french-german-leaders-call-on-eu-to-scrap-supply-chain-audit-law,2025-05-21T03:49:56,The Straits Times,Singapore,en
Rubio vows to keep stripping student visas in heated hearing,A Democratic senator said Mr Rubio was violating US constitutional protections of free speech and due process.,https://www.straitstimes.com/world/united-states/rubio-vows-to-keep-stripping-student-visas-in-heated-hearing,2025-05-21T03:48:29,The Straits Times,Singapore,en
Russia opens criminal case against journalist critical of Ukraine war,Russias Investigative Committee said on Tuesday that it had launched criminal proceedings against a prominent journalist who heads a publication in neighbouring Latvia providing critical coverage of the three-year-old conflict in Ukraine.,https://www.straitstimes.com/world/europe/russia-opens-criminal-case-against-journalist-critical-of-ukraine-war,2025-05-21T02:25:21,The Straits Times,Singapore,en
Ukraine launches probe into French-trained brigade,It comes after a media report alleged financial misconduct among commanders.,https://www.straitstimes.com/world/europe/ukraine-launches-probe-into-french-trained-brigade,2025-05-21T02:20:42,The Straits Times,Singapore,en
"American freed from Venezuela back in US, Trump envoy says","CARACASHOUSTON - A U.S. citizen who had been detained for months in Venezuela is back in the United States, U.S. President Donald Trump envoy Richard Grenell said on Tuesday, after the freed mans family said he had been handed over to U.S. authorities.",https://www.straitstimes.com/world/american-freed-from-venezuela-back-in-us-trump-envoy-says,2025-05-21T02:19:47,The Straits Times,Singapore,en
"Armed group attacks Russian base in Syria, say monitor, witness","Around 2,500 people are sheltering at Hmeimim air base, according to the Syrian Observatory for Human Rights monitor.",https://www.straitstimes.com/world/middle-east/armed-group-attacks-russian-base-in-syria-monitor-witness,2025-05-21T02:08:15,The Straits Times,Singapore,en
"Trump migrant detentions at Guantanamo Bay cost 129,000 per person daily, says senator",The White House has also requested a huge increase in funding for immigration enforcement.,https://www.straitstimes.com/world/united-states/trump-migrant-detentions-at-guantanamo-bay-cost-129000-per-person-daily-senator-says,2025-05-21T01:34:53,The Straits Times,Singapore,en
"EU will review trade deal with Israel, Kallas says","BRUSSELS - The European Unions top diplomat, Kaja Kallas, said on Tuesday that there would be a review of the EUs trade agreement with Israel amid the catastrophic situation in Gaza.",https://www.straitstimes.com/world/middle-east/eu-will-review-trade-deal-with-israel-kallas-says,2025-05-21T01:25:01,The Straits Times,Singapore,en
"Chile presidential palace, other buildings evacuated due to gas smell","SANTIAGO - Chiles La Moneda presidential palace and several other buildings in the capital of Santiago have been evacuated due to a strong smell of gas, according to witnesses and posts on social media on Tuesday.",https://www.straitstimes.com/world/chile-presidential-palace-other-buildings-evacuated-due-to-gas-smell,2025-05-21T01:24:50,The Straits Times,Singapore,en
"Syrian leadership approved return of dead spy archive to Israel, sources say","AMMANDAMASCUS - Syrias leadership approved the handover of the belongings of long-dead spy Eli Cohen to Israel in a bid to ease Israeli hostility and show goodwill to U.S. President Donald Trump, three sources told Reuters.",https://www.straitstimes.com/world/middle-east/syrian-leadership-approved-return-of-dead-spy-archive-to-israel-sources-say,2025-05-21T01:24:46,The Straits Times,Singapore,en
Trump-Putin call on war in Ukraine is another blow to Kyiv and its allies,The US president dropped his earlier insistence on an unconditional 30-day ceasefire.,https://www.straitstimes.com/world/europe/trump-putin-call-on-war-in-ukraine-is-another-blow-to-kyiv-and-its-allies,2025-05-21T01:20:17,The Straits Times,Singapore,en
EU adopts four sets of new sanctions against Russia,One package targets Moscows shadow fleet of sanction-evading oil tankers.,https://www.straitstimes.com/world/europe/eu-countries-adopt-four-sets-of-new-russia-sanctions,2025-05-21T01:20:06,The Straits Times,Singapore,en
"Russia extends pre-trial detention of billionaire Moshkovich till Aug 25, lawyer says","MOSCOW - A Russian court on Tuesday extended the pre-trial detention of Vadim Moshkovich, the billionaire founder of Russias top agriculture company Rusagro who faces charges of embezzlement, until August 25, his lawyer told Reuters.",https://www.straitstimes.com/world/europe/russia-extends-pre-trial-detention-of-billionaire-moshkovich-till-aug-25-lawyer-says,2025-05-21T01:19:53,The Straits Times,Singapore,en
Whats in the EUs new Russia sanctions,BRUSSELS - The European Union adopted on Tuesday its 17th package of sanctions against Russia over its full-scale invasion of Ukraine in 2022.,https://www.straitstimes.com/world/europe/whats-in-the-eus-new-russia-sanctions,2025-05-21T01:05:07,The Straits Times,Singapore,en
"US asking countries for voluntary relocation of Palestinians, says Rubio",President Donald Trump has repeatedly mused about displacing Gazas two million people to make way for reconstruction.,https://www.straitstimes.com/world/middle-east/us-asking-countries-for-voluntary-relocation-of-palestinians-says-rubio,2025-05-21T01:00:10,The Straits Times,Singapore,en
Uganda passes law to restore military prosecutions of civilians,"KAMPALA - Ugandas parliament on Tuesday passed an amended law that permits military tribunals to try civilians, prompting protests from the opposition who said the move violated a Supreme Court ruling in January that banned such trials.",https://www.straitstimes.com/world/uganda-passes-law-to-restore-military-prosecutions-of-civilians,2025-05-21T00:49:52,The Straits Times,Singapore,en
EU to impose 3 flat fee on small parcels from outside bloc,"E-commerce platforms would be expected to pay the levy on these parcels, which mostly come from China.",https://www.straitstimes.com/world/europe/eu-plans-two-euro-flat-fee-on-small-parcels-from-outside-bloc,2025-05-21T00:46:35,The Straits Times,Singapore,en
UK identifies atypical case of mad cow disease,It comes the day after Britain signed an EU deal that includes reducing checks on food and plant products.,https://www.straitstimes.com/world/europe/uk-identifies-atypical-case-of-mad-cow-disease,2025-05-21T00:36:52,The Straits Times,Singapore,en
Hungary says it has identified two more Ukrainian spies,"BUDAPEST - Hungarian security services have identified two Ukrainian spies, a government spokesman said on Tuesday, the latest in a series of mutual accusations of espionage between Budapest and Kyiv.",https://www.straitstimes.com/world/europe/hungary-says-it-has-identified-two-more-ukrainian-spies,2025-05-20T23:39:44,The Straits Times,Singapore,en
US expects Russia offer soon as Zelensky sounds warning,Ukrainian President Volodymyr Zelensky accused Moscow of buying time.,https://www.straitstimes.com/world/europe/rubio-says-trump-has-offered-no-concession-to-russias-putin,2025-05-20T23:32:41,The Straits Times,Singapore,en
EU proposes allowing deportation of asylum seekers to third countries,Anti-immigration sentiment has grown across the 27-nation EU since over a million people arrived in 2015.,https://www.straitstimes.com/world/europe/eu-proposes-allowing-deportation-of-asylum-seekers-to-third-countries,2025-05-20T23:24:51,The Straits Times,Singapore,en
Rubio says Syria could be weeks away from full-scale civil war of epic proportions,The top US diplomat spoke after a series of bloody attacks on the Alawite and Druze minorities in Syria.,https://www.straitstimes.com/world/middle-east/rubio-says-syria-could-be-weeks-away-from-full-scale-civil-war,2025-05-20T23:24:16,The Straits Times,Singapore,en
"Mexican ship in Brooklyn Bridge crash made no distress calls, Mexico navy chief says","MEXICO CITY - The Mexican Navy ship which crashed into New Yorks Brooklyn Bridge over the weekend made no distress calls before the accident but called for support instead, Mexicos Navy chief Raymundo Morales said on Tuesday.",https://www.straitstimes.com/world/mexican-ship-in-brooklyn-bridge-crash-made-no-distress-calls-mexico-navy-chief-says,2025-05-20T23:19:51,The Straits Times,Singapore,en
Elon Musk says he will spend a lot less on political campaigns,Musk spent a quarter of a billion dollars on US President Donald Trumps election campaign.,https://www.straitstimes.com/world/united-states/elon-musk-says-he-will-spend-a-lot-less-on-political-campaigns,2025-05-20T23:12:16,The Straits Times,Singapore,en
WHO says vaccine-derived poliovirus detected in Papua New Guinea,"Poliomyelitis, a highly infectious virus, can invade the nervous system and cause paralysis and death in young children.",https://www.straitstimes.com/world/europe/who-says-vaccine-derived-poliovirus-detected-in-papua-new-guinea,2025-05-20T23:09:43,The Straits Times,Singapore,en
Two top aides to Mexico City mayor shot dead by motorbike killers,MEXICO CITY - Two top aides of Mexico City Mayor Clara Brugada were shot dead after being ambushed by gunmen on a motorbike in a daytime attack in the city center on Tuesday.,https://www.straitstimes.com/world/two-top-aides-to-mexico-city-mayor-shot-dead-by-motorbike-killers,2025-05-20T22:59:58,The Straits Times,Singapore,en
UK man loses fight against extradition to US over 100 million wine fraud,LONDON - A British man accused of defrauding investors out of nearly 100 million through a Ponzi-like scheme involving non-existent luxury wines lost his fight against extradition from Britain to the United States on Tuesday.,https://www.straitstimes.com/world/europe/uk-man-loses-fight-against-extradition-to-us-over-100-million-wine-fraud,2025-05-20T22:59:54,The Straits Times,Singapore,en
Russias Lavrov says radical groups engaged in ethnic cleansing in Syria,MOSCOWDAMASCUS - Russian Foreign Minister Sergei Lavrov said on Tuesday that Moscow is deeply concerned by what he said was ethnic cleansing being carried out by radical militant groups in Syria.,https://www.straitstimes.com/world/europe/russias-lavrov-says-radical-groups-engaged-in-ethnic-cleansing-in-syria,2025-05-20T22:54:50,The Straits Times,Singapore,en
Explainer-The new US-backed Gaza aid plan and why the UN doesnt like it,"UNITED NATIONS - A U.S.-backed organization aims to start work in the Gaza Strip by the end of May overseeing a new model of aid distribution in the Palestinian enclave, but the United Nations says the plan is not impartial or neutral, and it wont be involved.",https://www.straitstimes.com/world/middle-east/explainer-the-new-us-backed-gaza-aid-plan-and-why-the-un-doesnt-like-it,2025-05-20T22:49:51,The Straits Times,Singapore,en
Poland to try suspect in alleged plot by Russia to assassinate Ukraines Zelensky,"Poland, a hub for Western military supplies to Ukraine, says it has become a major target of Russian spies.",https://www.straitstimes.com/world/europe/poland-to-try-suspect-in-alleged-plot-by-russia-to-assassinate-ukraines-zelensky,2025-05-20T22:34:49,The Straits Times,Singapore,en
