title,description,url,published_date,source,country,language
US FDA advisers to weigh composition of COVID vaccines for 2025-2026,The U.S. Food and Drug Administrations advisory panel is set to vote on Thursday to recommend whether COVID-19 vaccines for the 2025-2026 immunization campaign should target strains of the virus descending from the JN.1 variant.,https://www.straitstimes.com/world/us-fda-advisers-to-weigh-composition-of-covid-vaccines-for-2025-2026,2025-05-22T22:25:43,The Straits Times,Singapore,en
Kenyan court finds two guilty of aiding 2019 Nairobi hotel attack,"NAIROBI - A Kenyan court on Thursday found two people guilty of aiding a 2019 attack by al Qaeda-linked militants on a hotel and office complex in the capital that killed 21 people, the presiding judge said.",https://www.straitstimes.com/world/kenyan-court-finds-two-guilty-of-aiding-2019-nairobi-hotel-attack,2025-05-22T22:20:36,The Straits Times,Singapore,en
Brazil hopes to be officially free of bird flu in 28 days,SAO PAULO - Brazil began a 28-day bird flu observation period on Thursday which it hopes will show the countrys chicken farms are free of the disease after local authorities said a farm where its first outbreak was detected had been fully disinfected.,https://www.straitstimes.com/world/brazil-hopes-to-be-officially-free-of-bird-flu-in-28-days,2025-05-22T21:55:50,The Straits Times,Singapore,en
Small plane crashes into San Diego residential street,It smashed into houses and set multiple cars ablaze.,https://www.straitstimes.com/world/united-states/small-plane-crashes-into-san-diego-residential-street,2025-05-22T21:43:36,The Straits Times,Singapore,en
Person in custody after reported shooting at CIA headquarters,WASHINGTON - The CIA said its security personnel took a person into custody early Thursday after an engagement outside the intelligence agencys headquarters.,https://www.straitstimes.com/world/person-in-custody-after-reported-shooting-at-cia-headquarters,2025-05-22T21:35:35,The Straits Times,Singapore,en
"Palestinian minister reports 29 starvation-related deaths among Gazan children, elderly",GENEVA - The Palestinian health minister said on Thursday that 29 children and elderly people had died from starvation-related deaths in Gaza in recent days and that many thousands more were at risk.,https://www.straitstimes.com/world/europe/palestinian-minister-reports-29-starvation-related-deaths-among-gazan-children-elderly,2025-05-22T21:10:45,The Straits Times,Singapore,en
Kenya says Tanzanian authorities have released activist,"DAR ES SALAAM - Tanzania has released a Kenyan activist who had been arrested after he tried to attend a hearing in the treason case against a detained opposition leader in Dar es Salaam, Kenyan authorities said on Thursday.",https://www.straitstimes.com/world/kenya-says-tanzanian-authorities-have-released-activist,2025-05-22T20:16:14,The Straits Times,Singapore,en
Irish band Kneecap say terrorism charge seeks to silence artists,LONDON - Irish-language rap band Kneecap said on Thursday that a charge of a terrorism offence against one of its members for displaying a flag of banned militant group Hezbollah represented an attempt to prosecute artists who speak out.,https://www.straitstimes.com/world/europe/irish-band-kneecap-say-terrorism-charge-seeks-to-silence-artists,2025-05-22T20:16:01,The Straits Times,Singapore,en
Greece says Turkey must lift war threat to get access to EU defence funds,"ATHENS - Turkey must lift a 30-year old war threat against Greece if it wants Athens to consent to Ankara accessing European Union defence funds, Greek Prime Minister Kyriakos Mitsotakis said on Thursday.",https://www.straitstimes.com/world/europe/greece-says-turkey-must-lift-war-threat-to-get-access-to-eu-defence-funds,2025-05-22T20:15:50,The Straits Times,Singapore,en
"Final report on Lucy Letby baby murders due in early 2026, inquiry says","LONDON - The final report of a public inquiry into the murder of seven newborn babies by British nurse Lucy Letby will be published early next year, a statement on the inquirys website said on Thursday.",https://www.straitstimes.com/world/europe/final-report-on-lucy-letby-baby-murders-due-in-early-2026-inquiry-says,2025-05-22T20:15:40,The Straits Times,Singapore,en
"Trump tax Bill narrowly passes House, overcoming GOP infighting","215 lawmakers had voted for it, while 214 voted against.",https://www.straitstimes.com/world/united-states/trump-tax-bill-narrowly-passes-house-overcoming-gop-infighting,2025-05-22T20:07:55,The Straits Times,Singapore,en
"Iran warns Israel, US against any attack on its nuclear sites","DUBAI - The United States will bear legal responsibility in the event of an Israeli attack on Iranian nuclear facilities, Foreign Minister Abbas Araqchi said on Thursday, following a CNN report that Israel might be preparing strikes on Iran.",https://www.straitstimes.com/world/middle-east/iran-warns-israel-us-against-any-attack-on-its-nuclear-sites,2025-05-22T20:05:33,The Straits Times,Singapore,en
US climate pullback threatens planned debt-for-nature deals,LONDON - Billions of dollars of debt deals aimed at protecting vital ecosystems from Africa to Latin America are at risk of unravelling or may need rework amid concerns that crucial U.S. backing is about to dry up under President Donald Trump.,https://www.straitstimes.com/world/us-climate-pullback-threatens-planned-debt-for-nature-deals,2025-05-22T19:50:40,The Straits Times,Singapore,en
Global vaccine and health bodies could team up more to tackle US-led funding crisis,"LONDON - Two global health groups that fund billions of dollars worth of critical medical aid - from childhood vaccines to malaria treatments - are in talks about merging some functions to help combat a financing crunch, their chief executives told Reuters.",https://www.straitstimes.com/world/global-vaccine-and-health-bodies-could-team-up-more-to-tackle-us-led-funding-crisis,2025-05-22T19:40:40,The Straits Times,Singapore,en
France raises surveillance at Jewish-linked sites after Washington shooting,A gunman had shot and killed two Israeli embassy staff in the US.,https://www.straitstimes.com/world/europe/france-raises-surveillance-at-jewish-linked-sites-after-washington-shooting,2025-05-22T19:35:00,The Straits Times,Singapore,en
Brazils Senate approves bill to loosen environmental licensing,"BRASILIA - Brazils Senate has approved legislation to loosen environmental licensing, despite criticism from climate policy groups and figures inside President Luiz Inacio Lula da Silvas government.",https://www.straitstimes.com/world/brazils-senate-approves-bill-to-loosen-environmental-licensing,2025-05-22T19:25:40,The Straits Times,Singapore,en
Israel accuses Europe of anti-Semitic incitement after Washington shooting,Israel has faced criticism from Europe as it has intensified its military campaign in Gaza.,https://www.straitstimes.com/world/europe/israel-accuses-europe-of-anti-semitic-incitement-after-washington-shooting,2025-05-22T19:20:40,The Straits Times,Singapore,en
Israelis feel besieged by global antisemitism after Washington attacks,"JERUSALEM - When Jerusalem resident Ziv Halsband woke up to news that two staff members of the Israeli embassy in Washington had been killed, the software developer came to a disturbing conclusion Jews were not safe anywhere.",https://www.straitstimes.com/world/middle-east/israelis-feel-besieged-by-global-antisemitism-after-washington-attacks,2025-05-22T19:15:42,The Straits Times,Singapore,en
Firefighters test readiness as Greece enters wildfire season,"LAVRIO, Greece - On a hillside outside Athens, firefighters, rescuers and the army stand ready to tackle an encroaching wildfire near a summer camp - a scenario all too familiar in Greece, where climate change has made blazes more frequent and devastating.",https://www.straitstimes.com/world/europe/firefighters-test-readiness-as-greece-enters-wildfire-season,2025-05-22T19:05:46,The Straits Times,Singapore,en
EU brands just four countries as high risk under deforestation law,"Belarus, Myanmar, North Korea and Russia would be labelled as high risk.",https://www.straitstimes.com/world/europe/eu-brands-just-four-countries-as-high-risk-under-deforestation-law,2025-05-22T18:45:39,The Straits Times,Singapore,en
Lesbian mothers win legal status in Italy IVF ruling,"ROME - Italys Constitutional Court said on Thursday that same-sex female couples who use in vitro fertilization IVF abroad can both be legally recognised as parents in Italy, even if one is not the biological mother.",https://www.straitstimes.com/world/europe/lesbian-mothers-win-legal-status-in-italy-ivf-ruling,2025-05-22T18:40:42,The Straits Times,Singapore,en
Monument to Soviet dictator Josef Stalin in Moscow metro stirs debate,"Some Russians welcome the monument as a historical tribute, but others say it is a mistake.",https://www.straitstimes.com/world/europe/monument-to-soviet-dictator-josef-stalin-in-moscow-metro-stirs-debate,2025-05-22T18:35:44,The Straits Times,Singapore,en
Germany set to defend Nato neighbours with new brigade in Lithuania,"The brigade will comprise 4,800 troops and 2,000 vehicles when fully operational in end 2027.",https://www.straitstimes.com/world/europe/germany-set-to-defend-nato-neighbours-with-new-brigade-in-lithuania,2025-05-22T18:35:40,The Straits Times,Singapore,en
"Some bread and baby food reach Gazans as blockade eases, Palestinians call for more","Israel imposed the blockade on all supplies in March, causing a quarter of Gazas 2.3 million people to face famine.",https://www.straitstimes.com/world/middle-east/some-bread-and-baby-food-reach-gazans-as-blockade-eases-palestinians-call-for-more,2025-05-22T18:15:40,The Straits Times,Singapore,en
Trumps Golden Dome plan could launch new era of weapons in space,"WASHINGTON - U.S. President Donald Trumps Golden Dome missile defense concept revives a controversial, decades-old initiative whose ambitious construction could upend norms in outer space and reshape relations between the worlds top space powers.",https://www.straitstimes.com/world/trumps-golden-dome-plan-could-launch-new-era-of-weapons-in-space,2025-05-22T18:10:38,The Straits Times,Singapore,en
South Africans praise countrys President Ramaphosa for keeping cool amid Trump attack,Talks between the two leaders became a one-sided exchange as the US President made false claims.,https://www.straitstimes.com/world/south-africans-praise-countrys-president-ramaphosa-for-keeping-cool-amid-trump-attack,2025-05-22T17:20:45,The Straits Times,Singapore,en
Romanian top court rejects challenge to annul presidential election,BUCHAREST - Romanias Constitutional Court said on Thursday it had unanimously rejected a request to cancel the May 18 presidential election that was won by centrist Bucharest mayor Nicusor Dan.,https://www.straitstimes.com/world/europe/romanian-top-court-rejects-challenge-to-annul-presidential-election,2025-05-22T17:05:37,The Straits Times,Singapore,en
New German chancellery chief calls for tougher Russia sanctions,"BERLIN - Europe needs to step out of its comfort zone and consider much tougher sanctions on Russia, such as bans on gas or uranium, or tapping into frozen Russian state assets, Thorsten Frei, the chief of staff of Germanys new chancellor, told Reuters.",https://www.straitstimes.com/world/europe/new-german-chancellery-chief-calls-for-tougher-russia-sanctions,2025-05-22T15:50:37,The Straits Times,Singapore,en
"Illegal logging in rebel-held Congo threatens gorillas, alarms environmentalists","KABARE, Democratic Republic of Congo - Tropical forests in eastern Congo that fell into rebel hands this year have seen a spike in illegal logging to produce charcoal and timber, residents and environmentalists said, raising fears of large-scale degradation.",https://www.straitstimes.com/world/illegal-logging-in-rebel-held-congo-threatens-gorillas-alarms-environmentalists,2025-05-22T15:10:29,The Straits Times,Singapore,en
UK court lifts injunction allowing Chagos Islands deal to proceed,LONDON - Britain can conclude a deal with Mauritius on the future of the Chagos Islands on Thursday after a judge at Londons High Court overturned an eleventh-hour injunction which had blocked the agreement being signed earlier.,https://www.straitstimes.com/world/europe/uk-court-lifts-injunction-allowing-chagos-islands-deal-to-proceed,2025-05-22T14:45:34,The Straits Times,Singapore,en
Terror and hate will not break us Israel President on US shootings,Israeli President Isaac Herzog said the US and Israel would stand united in defence of our people.,https://www.straitstimes.com/world/middle-east/terror-and-hate-will-not-break-us-israel-president-on-us-shootings,2025-05-22T14:21:55,The Straits Times,Singapore,en
"Russia says it downs at least 105 Ukrainian drones, fires Iskander missile","MOSCOW - Russia said on Thursday it had shot down 105 Ukrainian drones over Russian regions, including dozens heading towards Moscow, as the war in Ukraine heats up even as major powers talk about ways to end Europes deadliest conflict since World War Two.",https://www.straitstimes.com/world/europe/russia-says-it-downs-at-least-105-ukrainian-drones-fires-iskander-missile,2025-05-22T13:45:26,The Straits Times,Singapore,en
Greek fire brigade on high alert after 6.1 magnitude quake strikes off Crete,"ATHENS - Emergency services were on high alert in Crete on Thursday after a 6.1 magnitude quake hit off the Greek island, causing tremors felt across Turkey and Israel.",https://www.straitstimes.com/world/europe/greek-fire-brigade-on-high-alert-after-6.1-magnitude-quake-strikes-off-crete,2025-05-22T13:10:25,The Straits Times,Singapore,en
Two Israeli embassy staff killed in Washington shooting lone suspect held,"US President Trump condemned the shooting, while Israeli PM Netanyahu said he was shocked by the killings.",https://www.straitstimes.com/world/united-states/two-israeli-embassy-staff-killed-in-washington-shooting,2025-05-22T11:50:24,The Straits Times,Singapore,en
"State Department refugee office to take USAids disaster aid role, says cable ridiculed by experts",Observers say the office lacks the know-how and personnel to mount responses to major overseas disasters.,https://www.straitstimes.com/world/united-states/state-department-refugee-office-to-assume-usaids-disaster-aid-role-says-cable,2025-05-22T09:45:29,The Straits Times,Singapore,en
Nike says its raising US prices but doesnt cite Trump tariffs,Sneakers currently between US100 S129 and US150 would see increases of up to US5.,https://www.straitstimes.com/world/united-states/nike-says-raising-us-prices-without-citing-trump-tariffs,2025-05-22T09:00:00,The Straits Times,Singapore,en
US Defence Secretary Hegseth meets Musk for second time at Pentagon,The Department of Defence said it is committed to engaging with AI industry CEOs.,https://www.straitstimes.com/world/united-states/us-defence-secretary-hegseth-meets-musk-for-second-time-at-pentagon,2025-05-22T08:51:00,The Straits Times,Singapore,en
Dozens injured in pension protest outside Argentina Congress,"BUENOS AIRES - Dozens of people were injured during a protest outside Argentinas Congress on Wednesday where activists and retired Argentines demanded higher pensions, according to Reuters witnesses.",https://www.straitstimes.com/world/dozens-injured-in-pension-protest-outside-argentina-congress,2025-05-22T08:50:30,The Straits Times,Singapore,en
Canadian finance minister touts progress in talks with US counterpart,"BANFF, Alberta - Canadas finance minister said on Wednesday that he had a good meeting with U.S. Treasury Secretary Scott Bessent and that both were pleased with the progress they were making.",https://www.straitstimes.com/world/canadian-finance-minister-touts-progress-in-talks-with-us-counterpart,2025-05-22T08:35:44,The Straits Times,Singapore,en
"Israel intercepts two missiles launched from Yemen, military says","Israels military said it intercepted two missiles launched from Yemen and that sirens had sounded twice across the country including in Jerusalem and the occupied West Bank on Thursday, as the Iran-aligned Houthis stepped up attacks.",https://www.straitstimes.com/world/middle-east/israel-intercepts-two-missiles-launched-from-yemen-military-says1,2025-05-22T08:35:27,The Straits Times,Singapore,en
Canada discussing joining US Golden Dome missile defence plan PM Carney,He warned of new and increasing missile threats that could come from space.,https://www.straitstimes.com/world/canada-discussing-joining-us-golden-dome-missile-defence-plan-pm-carney,2025-05-22T08:17:00,The Straits Times,Singapore,en
Why Trump wants a 515 million airplane rife with risks,The arrangement has raised questions about security considerations and the ethics of accepting such a gift.,https://www.straitstimes.com/world/united-states/why-trump-wants-a-515-million-airplane-rife-with-risks,2025-05-22T08:10:00,The Straits Times,Singapore,en
Graduates boo Columbias president at commencement after a fraught year,"Acting president Claire Shipman kept talking over the boos, delivering her remarks on democracy.",https://www.straitstimes.com/world/united-states/graduates-boo-columbias-president-at-commencement-after-a-fraught-year,2025-05-22T07:50:00,The Straits Times,Singapore,en
US sanctions four Cuban judicial officials for jailing political dissident,Mr Luis Robles had been arrested while protesting in Cuban capital Havana in December 2020.,https://www.straitstimes.com/world/united-states/us-sanctions-four-cuban-officials-for-jailing-political-dissident,2025-05-22T07:45:26,The Straits Times,Singapore,en
The Ambush Office Trumps Oval becomes test of nerves for world leaders,"An invitation to the Oval Office used to be a coveted prize, but now it could be a political ambush.",https://www.straitstimes.com/world/united-states/the-ambush-office-trumps-oval-becomes-test-of-nerve-for-world-leaders,2025-05-22T07:12:00,The Straits Times,Singapore,en
Second Oval Office ambush by Trump could make foreign leaders think twice,WASHINGTON - U.S. President Donald Trump turned down the lights in the Oval Office on Wednesday and made South African President Cyril Ramaphosa the target of his latest geopolitical ambush of a foreign leader in front of television cameras.,https://www.straitstimes.com/world/europe/second-oval-office-ambush-by-trump-could-make-foreign-leaders-think-twice,2025-05-22T06:55:26,The Straits Times,Singapore,en
UN dispatches around 90 aid trucks into Gaza,It is the first aid distribution in the Palestinian enclave since early March.,https://www.straitstimes.com/world/middle-east/netanyahu-says-ready-for-gaza-temporary-ceasefire,2025-05-22T06:45:00,The Straits Times,Singapore,en
"Detained Columbia student protester must be allowed to meet with wife, judge rules","NEW YORK - Detained Columbia University student and pro-Palestinian activist Mahmoud Khalil must be allowed to meet with his wife, a federal judge ruled on Wednesday.",https://www.straitstimes.com/world/middle-east/detained-columbia-student-protester-must-be-allowed-to-meet-with-wife-judge-rules,2025-05-22T06:00:30,The Straits Times,Singapore,en
"While You Were Sleeping 5 stories you might have missed, May 22, 2025","A selection of news stories that happened overnight, May 22, 2025.",https://www.straitstimes.com/world/while-you-were-sleeping-5-stories-you-might-have-missed-may-22-2025,2025-05-22T05:58:31,The Straits Times,Singapore,en
A check of Trumps false claims about white genocide in South Africa,JOHANNESBURG - Following is a look at some of the claims made by U.S. President Donald Trump about the alleged persecution of South Africas white minority. Trump made several false statements and misrepresented some facts during a contentious Oval Office meeting on Wednesday with President Cyril Ramaphosa.,https://www.straitstimes.com/world/a-check-of-trumps-false-claims-about-white-genocide-in-south-africa,2025-05-22T05:50:25,The Straits Times,Singapore,en
Armed group in Syrias Suwayda takes governor hostage for prisoners release,"CAIRO - An armed group briefly held the governor of Syrias Suwayda province hostage at the town hall on Wednesday, demanding and securing the release of an imprisoned associate, Syrias Information Ministry said in a statement.",https://www.straitstimes.com/world/middle-east/armed-group-in-syrias-suwayda-takes-governor-hostage-for-prisoners-release,2025-05-22T05:35:18,The Straits Times,Singapore,en
Israeli PM Netanyahu dismisses talk of rift with Trump,The US President visited the Middle East last week but skipped its closest ally Israel.,https://www.straitstimes.com/world/middle-east/israeli-pm-netanyahu-dismisses-speculation-of-rift-with-trump,2025-05-22T05:00:24,The Straits Times,Singapore,en
US accepts luxury jet from Qatar for use as Air Force One for Trump,Security upgrades ahead of its use could cost hundreds of millions of dollars.,https://www.straitstimes.com/world/united-states/us-accepts-luxury-jet-from-qatar-for-use-as-air-force-one-for-trump,2025-05-22T04:22:06,The Straits Times,Singapore,en
"G-7 finance leaders try to downplay tariff disputes, find consensus",The G-7 finance ministers and central bank governors were striving to issue a joint communique on non-tariff issues.,https://www.straitstimes.com/world/g-7-finance-leaders-try-to-downplay-tariff-disputes-find-consensus,2025-05-22T04:00:27,The Straits Times,Singapore,en
Julian Assange open to political action as Cannes hosts documentary,"CANNES, France - WikiLeaks founder Julian Assange, who is at the Cannes Film Festival this week for the documentary The Six Billion Dollar Man, is thinking about how to become politically active again once he has fully recovered from prison, said his wife, Stella.",https://www.straitstimes.com/world/julian-assange-open-to-political-action-as-cannes-hosts-documentary,2025-05-22T03:50:30,The Straits Times,Singapore,en
Trump calls his own foreign aid cuts at USAid devastating,Mr Trump said he wants other countries to start spending money on aid.,https://www.straitstimes.com/world/united-states/trump-calls-his-own-foreign-aid-cuts-at-usaid-devastating,2025-05-22T03:07:12,The Straits Times,Singapore,en
US says more construction materials fall under Iran sanctions,"WASHINGTON - People or entities that provide Iran with certain construction-related materials will face sanctions after the Trump administration said it found more materials were being used as part of Tehrans nuclear, ballistic or military programs.",https://www.straitstimes.com/world/middle-east/us-says-more-construction-materials-fall-under-iran-sanctions,2025-05-22T02:10:13,The Straits Times,Singapore,en
US Secretary of State believes more Arab states will normalise relations with Israel in 2025,"Saudi Arabia was in advanced talks on normalisation before Hamas attack on Israel on Oct 7, 2023.",https://www.straitstimes.com/world/middle-east/us-rubio-sees-more-arab-states-normalising-relations-with-israel-this-year,2025-05-22T02:00:45,The Straits Times,Singapore,en
Trump ambushes South Africas president over genocide accusation,Mr Trump played a video that purported to show evidence of a genocide of white South Africans.,https://www.straitstimes.com/world/united-states/trump-confronts-south-africas-ramaphosa-with-false-genocide-claims,2025-05-22T01:26:21,The Straits Times,Singapore,en
Government-commissioned report says Muslim Brotherhood posing threat to French unity,PARIS - President Emmanuel Macron convened senior ministers on Wednesday to address a state-commissioned report that accuses the Muslim Brotherhood of waging a covert campaign via local proxies to subvert Frances secular values and institutions.,https://www.straitstimes.com/world/europe/government-commissioned-report-says-muslim-brotherhood-posing-threat-to-french-unity,2025-05-22T01:15:22,The Straits Times,Singapore,en
"In call with Nato chief, Ukraines Zelensky says pressure needed on Russia to get a just peace",Ukraine and its allies are worried following a phone call between US President Donald Trump and Russias President.,https://www.straitstimes.com/world/europe/in-call-with-nato-chief-ukraines-zelensky-says-pressure-needed-on-russia,2025-05-22T00:50:29,The Straits Times,Singapore,en
Italy expects Nato to raise defence spending target to between 3.5 and 5 of GDP,"ROME - NATO will raise the defence spending target for its member nations to between 3.5 and 5 of gross domestic product GDP from the current 2 at the next alliance summit in June, Italys Defence Minister Guido Crosetto said on Wednesday.",https://www.straitstimes.com/world/europe/italy-expects-nato-to-raise-defence-spending-target-to-between-3-5-and-5-of-gdp,2025-05-22T00:50:19,The Straits Times,Singapore,en
US Rubio steers clear of branding Russias Putin a war criminal,The US Secretary of State said the priority was negotiating to end the war in Ukraine.,https://www.straitstimes.com/world/europe/us-rubio-steers-clear-of-branding-russias-putin-a-war-criminal,2025-05-22T00:43:28,The Straits Times,Singapore,en
Novo Nordisk Foundation pledges 57 million to WHO amid US funding gap,"The Novo Nordisk Foundation has pledged up to DKK 380 million 57.76 million to the World Health Organization WHO to expand its tie-up with the United Nations agency for another four years, the philanthropic body said on Wednesday.",https://www.straitstimes.com/world/europe/novo-nordisk-foundation-pledges-57-million-to-who-amid-us-funding-gap,2025-05-22T00:40:19,The Straits Times,Singapore,en
US Army to change transgender soldiers records to birth sex,"WASHINGTON - The U.S. Army will alter the records of transgender soldiers to show only their sex at birth, according to internal guidance seen by Reuters that details a series of steps it will take as it pushes them out of the service.",https://www.straitstimes.com/world/us-army-to-change-transgender-soldiers-records-to-birth-sex,2025-05-21T23:25:10,The Straits Times,Singapore,en
