title,description,url,published_date,source,country,language
"Ukraine has detained 50,000 men trying to flee since war began amid crackdown on draft dodgers",Ukraines army is struggling to recruit as the country fights off a Russian invasion.,https://www.straitstimes.com/world/europe/ukraine-detained-50000-men-trying-to-flee-since-war-began,2025-05-21T23:20:07,The Straits Times,Singapore,en
"Israel Supreme Court says decision to sack Shin Bet chief was illegal, Israeli media report","Israels Supreme Court has ruled that a government decision to sack the head of the domestic intelligence service Shin Bet was illegal and contrary to law, Israeli media reported on Wednesday.",https://www.straitstimes.com/world/middle-east/israel-supreme-court-says-decision-to-sack-shin-bet-chief-was-illegal-israeli-media-report,2025-05-21T23:15:17,The Straits Times,Singapore,en
"Trump officials violated court order over South Sudan deportation attempt, judge says","BOSTON - A federal judge ruled on Wednesday that the U.S. government violated his court order by attempting to deport migrants to South Sudan, opening another front in a battle between Donald Trump and judges who have imposed checks on the Republican presidents hardline immigration policies.",https://www.straitstimes.com/world/trump-officials-violated-court-order-over-south-sudan-deportation-attempt-judge-says,2025-05-21T23:10:10,The Straits Times,Singapore,en
"Kosovos political stalemate could put EU funds at risk, trade body warns","GDANSK, Poland - Kosovos parliament failed to elect a new speaker for the 15th straight time on Wednesday, prompting fears of an economic backlash after months of political stalemate in one of Europes poorest countries.",https://www.straitstimes.com/world/europe/kosovos-political-stalemate-could-put-eu-funds-at-risk-trade-body-warns,2025-05-21T23:05:19,The Straits Times,Singapore,en
Portugal to investigate far-right leader over anti-Roma remarks,"LISBON - Portuguese prosecutors have opened a probe into remarks made by far-right leader Andre Ventura against the Roma community, three days after an election in which his Chega party surged and was tied for second place in parliament.",https://www.straitstimes.com/world/europe/portugal-to-investigate-far-right-leader-over-anti-roma-remarks,2025-05-21T22:50:23,The Straits Times,Singapore,en
UK anti-Islam activist Tommy Robinson charged with harassment of two men,"LONDON - Prominent British anti-Islam activist Stephen Yaxley-Lennon has been charged with harassment causing fear of violence to two men around the time of the nationwide riots last year, prosecutors said on Wednesday.",https://www.straitstimes.com/world/europe/uk-anti-islam-activist-tommy-robinson-charged-with-harassment-of-two-men,2025-05-21T22:45:18,The Straits Times,Singapore,en
Israel draws outcry from Europe as soldiers fire near diplomats during West Bank visit,The Israeli military said the delegation had deviated from the approved route and that soldiers fired warning shots.,https://www.straitstimes.com/world/middle-east/israeli-soldiers-fire-near-diplomats-on-visit-to-occupied-west-bank,2025-05-21T22:05:13,The Straits Times,Singapore,en
"Russia says it downed hundreds of Ukrainian drones, briefly shuts Moscow airports","MOSCOW - Russia said on Wednesday its air defences shot down more than 370 Ukrainian drones, including some approaching Moscow, and the capitals airports were briefly shut down to ensure the safety of flights.",https://www.straitstimes.com/world/europe/russia-says-it-downed-hundreds-of-ukrainian-drones-briefly-shuts-moscow-airports,2025-05-21T21:55:20,The Straits Times,Singapore,en
Director Panahi ready to return to Iran after Cannes to work on next film,"CANNES, France - Although he is now free to travel again after a 15-year ban, Iranian director Jafar Panahi said on Wednesday he would be returning immediately to his country after attending the Cannes Film Festival to begin work on his next film.",https://www.straitstimes.com/world/europe/director-panahi-ready-to-return-to-iran-after-cannes-to-work-on-next-film,2025-05-21T21:45:44,The Straits Times,Singapore,en
"Britain, allies warn of cyber activity by Russia targeting delivery of support to Ukraine",A May 21 advisory urges organisations to take immediate action to protect themselves.,https://www.straitstimes.com/world/europe/uk-and-allies-warn-of-russian-cyber-activity-targeting-support-to-ukraine,2025-05-21T21:45:30,The Straits Times,Singapore,en
Trump nominates Darryl Nirenberg as new US ambassador to Romania,"WASHINGTON - President Donald Trump has chosen Darryl Nirenberg, a lawyer and former U.S. Senate staffer, to serve as the next U.S. ambassador to Romania.",https://www.straitstimes.com/world/europe/trump-nominates-darryl-nirenberg-as-new-us-ambassador-to-romania,2025-05-21T21:45:19,The Straits Times,Singapore,en
EU envoys reach deal on 219 billion arms fund,The fund would finance joint projects between EU countries.,https://www.straitstimes.com/world/europe/eu-envoys-reach-deal-on-219-billion-arms-fund,2025-05-21T21:45:15,The Straits Times,Singapore,en
UK pledges over 5 million in aid to Gaza,"LONDON - Britain pledged 4 million pounds 5.4 million in humanitarian aid to Gaza, the government said on Wednesday, as its Minister for Development Jenny Chapman visited Israel and the occupied Palestinian territories.",https://www.straitstimes.com/world/uk-pledges-over-5-million-in-aid-to-gaza,2025-05-21T21:40:15,The Straits Times,Singapore,en
Finland completes first 35 km of fence on Russian border,"NUIJAMAA, Finland - Finland has completed the first 35 km 22 miles of a 4.5-metre 15-ft high fence it is building on its closed eastern border with Russia to stop migrants from crossing via the wilderness, the Finnish Border Guard said on Wednesday.",https://www.straitstimes.com/world/europe/finland-completes-first-35-km-of-fence-on-russian-border,2025-05-21T21:35:25,The Straits Times,Singapore,en
"Vatican silent on Russia-Ukraine talks, leaving prospects uncertain","VATICAN CITY - Pope Leo XIV may have offered to host Russia-Ukraine peace talks at the Vatican, but neither the pope nor senior Vatican officials have spoken publicly about the possibility, leaving prospects for such talks uncertain.",https://www.straitstimes.com/world/europe/vatican-silent-on-russia-ukraine-talks-leaving-prospects-uncertain,2025-05-21T21:30:08,The Straits Times,Singapore,en
Czech president pardons soldiers prosecuted in death of Afghan prisoner,"PRAGUE - Czech President Petr Pavel granted pardons on Wednesday to four members of the countrys special forces, who had been facing prosecution for alleged crimes related to the death of a detained Afghan soldier.",https://www.straitstimes.com/world/europe/czech-president-pardons-soldiers-prosecuted-in-death-of-afghan-prisoner,2025-05-21T21:00:16,The Straits Times,Singapore,en
Gaza still waiting for aid as pressure mounts on Israel,Fewer than 100 aid trucks have entered Gaza since Israel agreed on May 19 to lift a blockade.,https://www.straitstimes.com/world/middle-east/gaza-still-waiting-for-aid-as-pressure-mounts-on-israel,2025-05-21T20:15:41,The Straits Times,Singapore,en
"Kenyan, Ugandan activists still in custody in Tanzania, law group says","NAIROBI - A Kenyan and a Ugandan activist detained in Tanzania after travelling to observe a court appearance by a jailed opposition leader are still in custody, Tanzanias Law Society said on Wednesday, after previously saying they had been deported.",https://www.straitstimes.com/world/kenyan-ugandan-activists-still-in-custody-in-tanzania-law-group-says,2025-05-21T20:15:15,The Straits Times,Singapore,en
Moscow mayor says air defences downed three approaching drones,"MOSCOW - Sergei Sobyanin, Moscows mayor, said on Wednesday that air defence forces had downed three drones en route to Russias capital.",https://www.straitstimes.com/world/europe/moscow-mayor-says-air-defences-downed-three-approaching-drones,2025-05-21T19:35:13,The Straits Times,Singapore,en
Why Europes criticism of Israel over aid to Gaza is a delicate task,"While expressing its horror at what is happening in Gaza, Europe also has to avoid angering the US.",https://www.straitstimes.com/world/europe/why-uk-france-and-canadas-criticism-of-israel-over-aid-to-gaza-is-a-delicate-path,2025-05-21T19:30:00,The Straits Times,Singapore,en
Poland intervenes as Russian shadow fleet ship spotted near power cable,"In the past, Moscow has denied involvement in undersea sabotage in the Baltic.",https://www.straitstimes.com/world/europe/poland-intervenes-as-russia-shadow-fleet-ship-spotted-near-power-cable,2025-05-21T19:05:25,The Straits Times,Singapore,en
Kremlin says Russia will defend its ships in the Baltic Sea with all means available,MOSCOW - The Kremlin said on Wednesday that Russia would defend its ships using the Baltic Sea with all means available and that a failed Estonian attempt to seize a tanker there recently showed that Moscow could respond with tough action if it had to.,https://www.straitstimes.com/world/europe/kremlin-says-russia-will-defend-its-ships-in-the-baltic-sea-with-all-means-available,2025-05-21T18:55:12,The Straits Times,Singapore,en
"Russia denies stalling peace talks, says no decision yet on venue",Pope Leo had reportedly confirmed he is willing to host the next round of negotiations.,https://www.straitstimes.com/world/europe/russia-denies-stalling-peace-talks-says-no-decision-yet-on-venue,2025-05-21T18:40:11,The Straits Times,Singapore,en
"Golden Dome shield could lead to resumption of Russia-US arms control contacts, says Kremlin",US President Donald Trumps Golden Dome is an ambitious project aimed at blocking threats from China and Russia.,https://www.straitstimes.com/world/europe/kremlin-suggests-golden-dome-could-lead-to-resumption-of-russia-us-arms-control-contacts,2025-05-21T18:35:12,The Straits Times,Singapore,en
"US to appoint Turkey ambassador Thomas Barrack as special envoy for Syria, sources say","DAMASCUSISTANBUL - The United States will appoint President Donald Trumps longtime advisor and current U.S. ambassador to Turkey, Thomas Barrack, as a special envoy for Syria, a person with direct knowledge of the matter and a diplomat in Turkey said.",https://www.straitstimes.com/world/europe/us-to-appoint-turkey-ambassador-thomas-barrack-as-special-envoy-for-syria-sources-say,2025-05-21T18:30:11,The Straits Times,Singapore,en
Ukrainian military says it hit Russian semiconductor device plant,"KYIV - A Ukrainian drone attack hit a semiconductor devices plant in Russias western Oryol region that supplies Russian fighter jet and missile producers, Ukraines military said on Wednesday.",https://www.straitstimes.com/world/europe/ukrainian-military-says-it-hit-russian-semiconductor-device-plant,2025-05-21T18:25:14,The Straits Times,Singapore,en
Hacker who breached communications app used by Trump aide stole data from across US government,"The trove included material from disaster responders, customs officials and the Secret Service.",https://www.straitstimes.com/world/united-states/hacker-who-breached-communications-app-used-by-trump-aide-stole-data-from-across-us-government,2025-05-21T18:05:12,The Straits Times,Singapore,en
South Sudans President Kiir promotes sanctioned ally as ruling party deputy,"NAIROBI - South Sudans President Salva Kiir has reshuffled the senior leadership in the ruling party, according to an official decree, as the country faces fresh fighting between rival armed factions and widespread speculation about Kiirs succession plans.",https://www.straitstimes.com/world/south-sudans-president-kiir-promotes-sanctioned-ally-as-ruling-party-deputy,2025-05-21T17:55:11,The Straits Times,Singapore,en
Germany arrests minors in strike against far-right terrorist group,FRANKFURT - German authorities on Wednesday arrested five adolescents suspected of forming a far-right terrorist group and said the charges included attempted murder and severe arson.,https://www.straitstimes.com/world/europe/germany-arrests-minors-in-strike-against-far-right-terrorist-group,2025-05-21T17:50:04,The Straits Times,Singapore,en
Congo ex-prime minister convicted of embezzlement in huge failed farm project,"A Congolese former prime minister was convicted of embezzling millions from a huge failed agriculture venture, in one of the highest-profile corruption cases brought under President Felix Tshisekedi against the government of his predecessor.",https://www.straitstimes.com/world/congo-ex-prime-minister-convicted-of-embezzlement-in-huge-failed-farm-project,2025-05-21T17:45:04,The Straits Times,Singapore,en
Donald Trump Jr says maybe one day he could run for president,"DOHA - U.S. President Donald Trumps eldest son, Donald Trump Jr., said on Wednesday he could maybe run for president one day.",https://www.straitstimes.com/world/united-states/donald-trump-jr-says-maybe-one-day-he-could-run-for-president,2025-05-21T17:40:14,The Straits Times,Singapore,en
Pope Leo appeals for Israel to allow humanitarian aid into Gaza,He has mentioned the situation in Gaza several times in the first weeks of his papacy.,https://www.straitstimes.com/world/europe/pope-leo-appeals-for-israel-to-allow-humanitarian-aid-in-gaza,2025-05-21T17:30:12,The Straits Times,Singapore,en
Cyber attack costs UK retailer Marks  Spencer 519 million,"Information stolen could include names, dates of birth, home addresses and telephone numbers.",https://www.straitstimes.com/world/europe/cyberattack-costs-uk-retailer-marks-spencer-519mil,2025-05-21T17:30:00,The Straits Times,Singapore,en
Pro-Russia ex-Ukraine politician shot dead outside elite US school in Madrid,"Andriy Portnov was a senior aide to Ukraines former pro-Russian president, Mr Viktor Yanukovych.",https://www.straitstimes.com/world/europe/pro-russia-ex-ukraine-politician-shot-dead-outside-elite-us-school-in-madrid,2025-05-21T17:15:16,The Straits Times,Singapore,en
Iraqs oil minister has reservations about energy agreements signed by Kurdish region,"BAGHDAD - Iraqs oil minister said that the federal government has reservations about energy agreements signed by the semi-autonomous Kurdistan region, after Iraqi Kurdish Prime Minister Masrour Barzani oversaw the signing of two deals with U.S. companies worth a combined 110 billion over their lifetimes.",https://www.straitstimes.com/world/middle-east/iraqs-oil-minister-has-reservations-about-energy-agreements-signed-by-kurdish-region,2025-05-21T17:15:12,The Straits Times,Singapore,en
"Our children are dying slowly, says father searching for food in Gaza","Israel has blocked the entry of medical, food and fuel supplies into Gaza since the start of March.",https://www.straitstimes.com/world/middle-east/our-children-are-dying-slowly-says-father-searching-for-food-in-gaza,2025-05-21T16:45:10,The Straits Times,Singapore,en
Romanian hard-right presidential candidate challenges election defeat,"Romanias defeated hard-right presidential contender George Simion said late on Tuesday that he would challenge the ballots result, alleging interference by France and Moldova, after a centrist victory was met with relief by many European leaders.",https://www.straitstimes.com/world/europe/romanian-hard-right-presidential-candidate-challenges-election-defeat,2025-05-21T16:35:11,The Straits Times,Singapore,en
Iran executes man responsible for Azerbaijan embassy attack,"DUBAIBAKU - A man convicted of a fatal shooting at Azerbaijans embassy in the Iranian capital, Tehran, was executed on Wednesday, Irans judiciary news outlet Mizan said.",https://www.straitstimes.com/world/europe/iran-executes-man-responsible-for-azerbaijan-embassy-attack,2025-05-21T16:15:12,The Straits Times,Singapore,en
Ukraine to ask EU to lead on Russia sanctions as US wavers,Kyiv will present a 40-page white paper to the European Union with recommendations on sanctions.,https://www.straitstimes.com/world/europe/ukraine-to-ask-eu-to-lead-on-russia-sanctions-as-us-wavers,2025-05-21T16:05:11,The Straits Times,Singapore,en
Irans Parliament approves strategic pact with Russia,"The agreement represents a deepening of bilateral ties, including closer defence cooperation.",https://www.straitstimes.com/world/europe/iran-parliament-approves-strategic-pact-with-russia,2025-05-21T15:40:21,The Straits Times,Singapore,en
Russian missile attack kills Ukrainian servicemen in training,"KYIV - A Russian missile attack on a Ukrainian military shooting range killed six servicemen and wounded at least 10 more during training on Tuesday, Ukraines national guard said on Wednesday, adding that the commander of the unit had been suspended.",https://www.straitstimes.com/world/europe/russian-missile-attack-kills-ukrainian-servicemen-in-training,2025-05-21T15:30:02,The Straits Times,Singapore,en
British climbers summit Everest in record bid,The team is raising money for veterans charities.,https://www.straitstimes.com/world/british-climbers-summit-everest-in-record-bid,2025-05-21T14:59:25,The Straits Times,Singapore,en
Putin visits Kursk region for first time since ejecting Ukrainian forces,MOSCOW - Russian President Vladimir Putin visited the western Kursk region for the first time since Russian forces ejected Ukrainian troops from the area last month.,https://www.straitstimes.com/world/europe/putin-visits-kursk-region-for-first-time-since-ejecting-ukrainian-forces,2025-05-21T14:15:08,The Straits Times,Singapore,en
Is red meat bad for your heart? It may depend on who funded the study,"When any food industry group pays for research, the goal is often to promote and sell more of its product.",https://www.straitstimes.com/world/is-red-meat-bad-for-your-heart-it-may-depend-on-who-funded-the-study,2025-05-21T13:25:28,The Straits Times,Singapore,en
"Estimated 6 billion barrel shale oil reserve in southeast Turkey, minister says","SIRNAK, Turkey - U.S. oil producer Continental Resources estimates there is a shale oil reserve of 6.1 billion barrels in Turkeys southeastern Diyarbakir Basin, the Turkish energy minister said.",https://www.straitstimes.com/world/europe/estimated-6-billion-barrel-shale-oil-reserve-in-southeast-turkey-minister-says,2025-05-21T13:05:02,The Straits Times,Singapore,en
"Turkey in nuclear plant talks with Candu, energy minister says","SIRNAK, Turkey - Turkey is in talks with Canadas Candu Energy and other companies regarding plans to build its second and third nuclear power plants, Turkish Energy Minister Alparslan Bayraktar said.",https://www.straitstimes.com/world/middle-east/turkey-in-nuclear-plant-talks-with-candu-energy-minister-says,2025-05-21T13:04:59,The Straits Times,Singapore,en
South Africas Ramaphosa faces Trump with deals on offer and golfers in tow,JOHANNESBURGWASHINGTON - South African President Cyril Ramaphosa heads to the White House on Wednesday on a perilous mission to persuade a hostile Donald Trump to make deals with his country rather than scold and punish it as he has done since the start of his second term.,https://www.straitstimes.com/world/south-africas-ramaphosa-faces-trump-with-deals-on-offer-and-golfers-in-tow,2025-05-21T12:05:05,The Straits Times,Singapore,en
18 football fields of tropical forest lost every minute in 2024 largely due to fires Study,"Tree cover loss in tropical primary forests reached a record 6.7 million ha, nearly double 2023s figure.",https://www.straitstimes.com/world/18-football-fields-of-tropical-forest-lost-every-minute-in-2024-largely-due-to-fires-study,2025-05-21T12:01:00,The Straits Times,Singapore,en
"US Justice Department investigating former New York governor Cuomo, sources say",He is seen as the front runner in the Democratic primary election for New York City mayor on June 24.,https://www.straitstimes.com/world/united-states/us-justice-department-investigating-former-new-york-governor-cuomo-sources-say,2025-05-21T10:35:03,The Straits Times,Singapore,en
Student stabs three girls in Finland school attack,"The suspect is believed to have sent a manifesto to media outlets, stating his intent to kill girls.",https://www.straitstimes.com/world/europe/student-stabs-three-girls-in-finland-school-attack,2025-05-21T09:50:00,The Straits Times,Singapore,en
US finds endangered Gulf of Mexico whale threatened by oil and gas vessel strikes,There are an estimated 51 Rices whales in the Gulf.,https://www.straitstimes.com/world/united-states/us-finds-endangered-gulf-of-mexico-whale-threatened-by-oil-and-gas-vessel-strikes,2025-05-21T09:36:00,The Straits Times,Singapore,en
Trumps Gulf deal-making spree also benefited Elon Musk and his family,Mr Musks companies have raised money from government-linked and regional funds in the Persian Gulf.,https://www.straitstimes.com/world/united-states/trumps-gulf-deal-making-spree-also-benefited-elon-musk-and-his-family,2025-05-21T09:35:00,The Straits Times,Singapore,en
El Salvador Congress passes law taxing foreign donations to NGOs,SAN SALVADOR - El Salvadors Congress passed a law on Tuesday that levies a 30 tax on transactions from foreign donors to local organizations in a crackdown on foreign agents that critics say will boost state control over non-governmental organizations.,https://www.straitstimes.com/world/el-salvador-congress-passes-law-taxing-foreign-donations-to-ngos,2025-05-21T09:20:01,The Straits Times,Singapore,en
New Orleans jail employee arrested and charged with helping 10 inmates escape,"He shut off water at the jail, which allowed inmates to remove a sink and toilet fixture from the wall.",https://www.straitstimes.com/world/united-states/new-orleans-jail-employee-is-arrested-and-charged-with-helping-10-inmates-escape,2025-05-21T09:15:15,The Straits Times,Singapore,en
First blood test for Alzheimers available in US in June,The test potentially makes it easier to find and treat patients with the memory-robbing disease.,https://www.straitstimes.com/world/united-states/first-alzheimers-blood-test-available-in-us-in-june,2025-05-21T09:15:00,The Straits Times,Singapore,en
"In approving soda ban for food stamps, US govt reverses decades of policy","It is likely to pave the way for more state waivers, signaling a sharp shift in nutrition policy.",https://www.straitstimes.com/world/united-states/in-approving-soda-ban-for-food-stamps-usda-reverses-decades-of-policy,2025-05-21T09:05:00,The Straits Times,Singapore,en
"Canada says G-7 finance ministers to focus on restoring stability, growth",The meetings will include discussions about excess manufacturing capacity and financial crimes.,https://www.straitstimes.com/world/canada-says-g-7-finance-ministers-to-focus-on-restoring-stability-growth,2025-05-21T08:30:04,The Straits Times,Singapore,en
US immigration chief mistakes key legal term at Congress hearing,Mrs Kristi Noem said the Trump administration would comply with any court ruling on habeas corpus.,https://www.straitstimes.com/world/united-states/us-immigration-chief-mistakes-key-legal-term-at-congress-hearing,2025-05-21T08:15:00,The Straits Times,Singapore,en
Biden had not received prostate cancer screening since 2014 Spokesperson,The former US presidents last known test for prostate cancer was in 2014.,https://www.straitstimes.com/world/united-states/biden-had-not-received-prostate-cancer-screening-since-2014-spokesperson-says,2025-05-21T07:22:39,The Straits Times,Singapore,en
Trump likely to confront South Africas Ramaphosa over equity mandates affecting U.S. firms,"WASHINGTONJOHANNESBURG - U.S. President Donald Trump is expected to raise several issues in a meeting with South African President Cyril Ramaphosa on Wednesday, including seeking an exemption for U.S. companies from laws requiring equity ownership by disadvantaged groups, a White House official told Reuters.",https://www.straitstimes.com/world/trump-likely-to-confront-south-africas-ramaphosa-over-equity-mandates-affecting-u.s.-firms,2025-05-21T07:20:02,The Straits Times,Singapore,en
US limits Covid-19 boosters to over-65s or those at high risk,"Vaccine makers are required to run fresh trials before offering shots to younger, healthier individuals.",https://www.straitstimes.com/world/united-states/us-limits-covid-19-boosters-to-over-65s-or-those-at-high-risk,2025-05-21T07:18:00,The Straits Times,Singapore,en
"US intel suggests Israel preparing strike on Irans nuclear facilities, CNN reports",It was not clear whether Israeli leaders have made a final decision.,https://www.straitstimes.com/world/us-intel-suggests-israel-preparing-strike-on-irans-nuclear-facilities-cnn-reports,2025-05-21T07:09:52,The Straits Times,Singapore,en
Iran faces US without Plan B as nuclear red lines collide,The clerical leadership lacks a clear fallback plan if efforts to resolve the dispute collapse.,https://www.straitstimes.com/world/middle-east/iran-faces-u-s-without-plan-b-as-nuclear-red-lines-collide,2025-05-21T06:04:59,The Straits Times,Singapore,en
"While You Were Sleeping 5 stories you might have missed, May 21, 2025","A selection of news stories that happened overnight, May 21, 2025.",https://www.straitstimes.com/world/while-you-were-sleeping-5-stories-you-might-have-missed-may-21-2025,2025-05-21T06:02:21,The Straits Times,Singapore,en
"US is not withdrawing from the world, says Rubio during testy hearings in Congress","The Secretary of State was challenged over immigration, Ukraine and resettling white South Africans, among other issues.",https://www.straitstimes.com/world/united-states/us-is-not-withdrawing-from-the-world-rubio-says-during-testy-hearings-in-congress,2025-05-21T05:32:45,The Straits Times,Singapore,en
"UAE agrees with Israel to allow delivery of urgent aid to Gaza, WAM reports","CAIRO - The United Arab Emirates said on Tuesday it agreed with Israel to allow delivery of urgent humanitarian aid from the Gulf country to Gaza, the state news agency WAM reported.",https://www.straitstimes.com/world/middle-east/uae-agrees-with-israel-to-allow-delivery-of-urgent-aid-to-gaza-wam-reports,2025-05-21T05:24:57,The Straits Times,Singapore,en
